_type,url,date,content,renderedContent,id,user,replyCount,retweetCount,likeCount,quoteCount,conversationId,lang,source,sourceUrl,sourceLabel,outlinks,tcooutlinks,media,retweetedTweet,quotedTweet,inReplyToTweetId,inReplyToUser,mentionedUsers,coordinates,place,hashtags,cashtags
snscrape.modules.twitter.Tweet,https://twitter.com/HeyLannyCamden/status/1474149986187321347,2021-12-23 22:48:39+00:00,"Another reason Russia wants it

The oil pipe lines feeding Europe goes through Ukraine

One reason Hunter Biden was using his influence &amp; getting big money to be on the board of Burisma Holdings which was being investigated

 https://t.co/oW0z9k4AVQ https://t.co/hQphGnUJlv","Another reason Russia wants it

The oil pipe lines feeding Europe goes through Ukraine

One reason Hunter Biden was using his influence &amp; getting big money to be on the board of Burisma Holdings which was being investigated

 youtu.be/KCF9My1vBP4 twitter.com/ToscaAusten/st…",1474149986187321347,"{'_type': 'snscrape.modules.twitter.User', 'username': 'HeyLannyCamden', 'id': 347507710, 'displayname': 'Lanny Camden🇺🇸🇺🇸🇺🇸', 'description': 'Vietnam 1970. Conservative. Lover of Jesus Christ♥️Husband 49 years. Favor Republican Party Love America✍️ 2nd Amendment-Concern of left Hypocrasy Democrats', 'rawDescription': 'Vietnam 1970. Conservative. Lover of Jesus Christ♥️Husband 49 years. Favor Republican Party Love America✍️ 2nd Amendment-Concern of left Hypocrasy Democrats', 'descriptionUrls': None, 'verified': False, 'created': '2011-08-02T22:22:26+00:00', 'followersCount': 2420, 'friendsCount': 5006, 'statusesCount': 72118, 'favouritesCount': 50490, 'listedCount': 58, 'mediaCount': 8706, 'location': 'America FL & MO', 'protected': False, 'linkUrl': 'https://arkencounter.com/', 'linkTcourl': 'https://t.co/tgY4cgJsJy', 'profileImageUrl': 'https://pbs.twimg.com/profile_images/1481813297460563975/IXuMXDas_normal.jpg', 'profileBannerUrl': 'https://pbs.twimg.com/profile_banners/347507710/1629592533', 'label': None, 'url': 'https://twitter.com/HeyLannyCamden'}",0,0,0,0,1474149986187321347,en,"<a href=""http://twitter.com/download/android"" rel=""nofollow"">Twitter for Android</a>",http://twitter.com/download/android,Twitter for Android,"['https://youtu.be/KCF9My1vBP4', 'https://twitter.com/ToscaAusten/status/1474026771976757250']","['https://t.co/oW0z9k4AVQ', 'https://t.co/hQphGnUJlv']",,,"{'_type': 'snscrape.modules.twitter.Tweet', 'url': 'https://twitter.com/ToscaAusten/status/1474026771976757250', 'date': '2021-12-23T14:39:03+00:00', 'content': 'In the 19th century, Ukraine was known as “Malorossiya” or “Little Russia” –Vladimir Putin wants it back, snapping the country back into Russia’s geopolitical puzzle.\n\nWeak Joe Biden talks tough, then runs away. Then sends Putin hollow snail mail warnings. https://t.co/hqX1LzhYHS', 'renderedContent': 'In the 19th century, Ukraine was known as “Malorossiya” or “Little Russia” –Vladimir Putin wants it back, snapping the country back into Russia’s geopolitical puzzle.\n\nWeak Joe Biden talks tough, then runs away. Then sends Putin hollow snail mail warnings. nbcnews.com/news/world/put…', 'id': 1474026771976757250, 'user': {'_type': 'snscrape.modules.twitter.User', 'username': 'ToscaAusten', 'id': 4769536303, 'displayname': 'Tosca Austen', 'description': 'Ghostwriter.Political Aficionado, Bonvivant 🍃Ballet l’Opéra Paris 🎶Trilingual: English,French,Italian🇺🇸🇮🇹 Critical Thinker, Indy.', 'rawDescription': 'Ghostwriter.Political Aficionado, Bonvivant 🍃Ballet l’Opéra Paris 🎶Trilingual: English,French,Italian🇺🇸🇮🇹 Critical Thinker, Indy.', 'descriptionUrls': None, 'verified': False, 'created': '2016-01-16T17:33:26+00:00', 'followersCount': 42814, 'friendsCount': 21191, 'statusesCount': 291695, 'favouritesCount': 122523, 'listedCount': 43, 'mediaCount': 21261, 'location': 'DeBlasio Cuomo Refugee', 'protected': False, 'linkUrl': None, 'linkTcourl': None, 'profileImageUrl': 'https://pbs.twimg.com/profile_images/1298241226156769282/k_oDUmyf_normal.jpg', 'profileBannerUrl': 'https://pbs.twimg.com/profile_banners/4769536303/1645304976', 'label': None, 'url': 'https://twitter.com/ToscaAusten'}, 'replyCount': 5, 'retweetCount': 16, 'likeCount': 21, 'quoteCount': 2, 'conversationId': 1474026771976757250, 'lang': 'en', 'source': '<a href=""http://twitter.com/download/iphone"" rel=""nofollow"">Twitter for iPhone</a>', 'sourceUrl': 'http://twitter.com/download/iphone', 'sourceLabel': 'Twitter for iPhone', 'outlinks': ['https://www.nbcnews.com/news/world/putin-russia-ukraine-war-demands-nato-biden-rcna9753'], 'tcooutlinks': ['https://t.co/hqX1LzhYHS'], 'media': None, 'retweetedTweet': None, 'quotedTweet': None, 'inReplyToTweetId': None, 'inReplyToUser': None, 'mentionedUsers': None, 'coordinates': None, 'place': None, 'hashtags': None, 'cashtags': None}",,,,,,,
snscrape.modules.twitter.Tweet,https://twitter.com/FMTadvisory/status/1474119815824502807,2021-12-23 20:48:46+00:00,"2022 predictions: Crude Oil 100+, BTC 100k +, ETH 9k +, big geopolitical events (China &gt; Taiwan?, Russia &gt; Ukraine?, Saudia Arabia &gt; fossil not in dollars?, Civil unrest?), inflation continues to scream.","2022 predictions: Crude Oil 100+, BTC 100k +, ETH 9k +, big geopolitical events (China &gt; Taiwan?, Russia &gt; Ukraine?, Saudia Arabia &gt; fossil not in dollars?, Civil unrest?), inflation continues to scream.",1474119815824502807,"{'_type': 'snscrape.modules.twitter.User', 'username': 'FMTadvisory', 'id': 3240169122, 'displayname': 'FMT Investment Advisory', 'description': 'A Fiduciary Advisory Managing Money in the New Economy FMTadvisory.com', 'rawDescription': 'A Fiduciary Advisory Managing Money in the New Economy https://t.co/Spa6rx39Zx', 'descriptionUrls': [{'text': 'FMTadvisory.com', 'url': 'http://FMTadvisory.com', 'tcourl': 'https://t.co/Spa6rx39Zx', 'indices': [55, 78]}], 'verified': False, 'created': '2015-06-08T20:59:33+00:00', 'followersCount': 190, 'friendsCount': 33, 'statusesCount': 1173, 'favouritesCount': 404, 'listedCount': 4, 'mediaCount': 78, 'location': '', 'protected': False, 'linkUrl': None, 'linkTcourl': None, 'profileImageUrl': 'https://pbs.twimg.com/profile_images/1371169224501039105/4i71GnnJ_normal.jpg', 'profileBannerUrl': 'https://pbs.twimg.com/profile_banners/3240169122/1434590460', 'label': None, 'url': 'https://twitter.com/FMTadvisory'}",0,0,0,0,1474119815824502807,en,"<a href=""https://mobile.twitter.com"" rel=""nofollow"">Twitter Web App</a>",https://mobile.twitter.com,Twitter Web App,,,,,,,,,,,,
snscrape.modules.twitter.Tweet,https://twitter.com/AmericaeNatione/status/1474105812276686850,2021-12-23 19:53:07+00:00,"@PanAmCD @Tierra_Y_Cielo Ukraine is actually what Russia would look like without oil and gas. Oil and gas are the only thing that keeps that military spending on relevant level. However, the number of combat ready troops trained and equipped to Western standards is much smaller than total number suggests","@PanAmCD @Tierra_Y_Cielo Ukraine is actually what Russia would look like without oil and gas. Oil and gas are the only thing that keeps that military spending on relevant level. However, the number of combat ready troops trained and equipped to Western standards is much smaller than total number suggests",1474105812276686850,"{'_type': 'snscrape.modules.twitter.User', 'username': 'AmericaeNatione', 'id': 859988128681144324, 'displayname': 'Americae Natione 🇺🇸', 'description': 'American Nation will rise again! 🇺🇸', 'rawDescription': 'American Nation will rise again! 🇺🇸', 'descriptionUrls': None, 'verified': False, 'created': '2017-05-04T04:28:42+00:00', 'followersCount': 318, 'friendsCount': 266, 'statusesCount': 14954, 'favouritesCount': 53414, 'listedCount': 6, 'mediaCount': 185, 'location': 'Alabama, USA', 'protected': False, 'linkUrl': None, 'linkTcourl': None, 'profileImageUrl': 'https://pbs.twimg.com/profile_images/1146843718911176705/O2TVhbv-_normal.png', 'profileBannerUrl': 'https://pbs.twimg.com/profile_banners/859988128681144324/1562307851', 'label': None, 'url': 'https://twitter.com/AmericaeNatione'}",0,0,2,0,1474081642247606275,en,"<a href=""http://twitter.com/download/android"" rel=""nofollow"">Twitter for Android</a>",http://twitter.com/download/android,Twitter for Android,,,,,,1.4740848672856596e+18,"{'_type': 'snscrape.modules.twitter.User', 'username': 'PanAmCD', 'id': 938964395979427842, 'displayname': 'PanAm ꓘK', 'description': None, 'rawDescription': None, 'descriptionUrls': None, 'verified': None, 'created': None, 'followersCount': None, 'friendsCount': None, 'statusesCount': None, 'favouritesCount': None, 'listedCount': None, 'mediaCount': None, 'location': None, 'protected': None, 'linkUrl': None, 'linkTcourl': None, 'profileImageUrl': None, 'profileBannerUrl': None, 'label': None, 'url': 'https://twitter.com/PanAmCD'}","[{'_type': 'snscrape.modules.twitter.User', 'username': 'PanAmCD', 'id': 938964395979427842, 'displayname': 'PanAm ꓘK', 'description': None, 'rawDescription': None, 'descriptionUrls': None, 'verified': None, 'created': None, 'followersCount': None, 'friendsCount': None, 'statusesCount': None, 'favouritesCount': None, 'listedCount': None, 'mediaCount': None, 'location': None, 'protected': None, 'linkUrl': None, 'linkTcourl': None, 'profileImageUrl': None, 'profileBannerUrl': None, 'label': None, 'url': 'https://twitter.com/PanAmCD'}]",,,,
snscrape.modules.twitter.Tweet,https://twitter.com/ngreer12/status/1474063766773977097,2021-12-23 17:06:03+00:00,Why are we not talking about the Russia-Ukraine conflict being about oil &amp; gas?,Why are we not talking about the Russia-Ukraine conflict being about oil &amp; gas?,1474063766773977097,"{'_type': 'snscrape.modules.twitter.User', 'username': 'ngreer12', 'id': 2427898224, 'displayname': 'Dr. Nan Greer', 'description': 'Author, Ecological Anthropologist, Investment Banker, Mom, Philanthropist, & Professor', 'rawDescription': 'Author, Ecological Anthropologist, Investment Banker, Mom, Philanthropist, & Professor', 'descriptionUrls': None, 'verified': False, 'created': '2014-04-04T22:03:16+00:00', 'followersCount': 176, 'friendsCount': 1348, 'statusesCount': 450, 'favouritesCount': 1858, 'listedCount': 1, 'mediaCount': 12, 'location': '', 'protected': False, 'linkUrl': None, 'linkTcourl': None, 'profileImageUrl': 'https://pbs.twimg.com/profile_images/1415666053548445700/hf04Cxpm_normal.jpg', 'profileBannerUrl': 'https://pbs.twimg.com/profile_banners/2427898224/1446591146', 'label': None, 'url': 'https://twitter.com/ngreer12'}",0,0,1,0,1474063766773977097,en,"<a href=""http://twitter.com/download/iphone"" rel=""nofollow"">Twitter for iPhone</a>",http://twitter.com/download/iphone,Twitter for iPhone,,,,,,,,,,,,
snscrape.modules.twitter.Tweet,https://twitter.com/DBhaduri94/status/1474058432558686208,2021-12-23 16:44:51+00:00,@KremlinRussia_E Europe &amp; US have limited economic options to counter Russian aggression against Ukraine. Russian natural gas &amp; oil constitutes 39% &amp; 7% of European &amp; US imports respectively. With limited leverage @NATO will have to either continue diplomacy or pre-empt Russian military action.,@KremlinRussia_E Europe &amp; US have limited economic options to counter Russian aggression against Ukraine. Russian natural gas &amp; oil constitutes 39% &amp; 7% of European &amp; US imports respectively. With limited leverage @NATO will have to either continue diplomacy or pre-empt Russian military action.,1474058432558686208,"{'_type': 'snscrape.modules.twitter.User', 'username': 'DBhaduri94', 'id': 142553209, 'displayname': 'Debabrata Bhaduri', 'description': 'REALIST', 'rawDescription': 'REALIST', 'descriptionUrls': None, 'verified': False, 'created': '2010-05-11T04:55:59+00:00', 'followersCount': 99, 'friendsCount': 438, 'statusesCount': 3785, 'favouritesCount': 221, 'listedCount': 1, 'mediaCount': 312, 'location': 'Kolkata', 'protected': False, 'linkUrl': 'http://www.debabratabhaduri.wordpress.com', 'linkTcourl': 'https://t.co/XWFkpOCjFH', 'profileImageUrl': 'https://pbs.twimg.com/profile_images/1139557048008364032/AeWp39Pm_normal.jpg', 'profileBannerUrl': 'https://pbs.twimg.com/profile_banners/142553209/1566320040', 'label': None, 'url': 'https://twitter.com/DBhaduri94'}",1,0,0,0,1458850137996812288,en,"<a href=""https://mobile.twitter.com"" rel=""nofollow"">Twitter Web App</a>",https://mobile.twitter.com,Twitter Web App,,,,,,1.474031072199385e+18,"{'_type': 'snscrape.modules.twitter.User', 'username': 'DBhaduri94', 'id': 142553209, 'displayname': 'Debabrata Bhaduri', 'description': 'REALIST', 'rawDescription': 'REALIST', 'descriptionUrls': None, 'verified': False, 'created': '2010-05-11T04:55:59+00:00', 'followersCount': 99, 'friendsCount': 438, 'statusesCount': 3785, 'favouritesCount': 221, 'listedCount': 1, 'mediaCount': 312, 'location': 'Kolkata', 'protected': False, 'linkUrl': 'http://www.debabratabhaduri.wordpress.com', 'linkTcourl': 'https://t.co/XWFkpOCjFH', 'profileImageUrl': 'https://pbs.twimg.com/profile_images/1139557048008364032/AeWp39Pm_normal.jpg', 'profileBannerUrl': 'https://pbs.twimg.com/profile_banners/142553209/1566320040', 'label': None, 'url': 'https://twitter.com/DBhaduri94'}","[{'_type': 'snscrape.modules.twitter.User', 'username': 'KremlinRussia_E', 'id': 205622130, 'displayname': 'President of Russia', 'description': None, 'rawDescription': None, 'descriptionUrls': None, 'verified': None, 'created': None, 'followersCount': None, 'friendsCount': None, 'statusesCount': None, 'favouritesCount': None, 'listedCount': None, 'mediaCount': None, 'location': None, 'protected': None, 'linkUrl': None, 'linkTcourl': None, 'profileImageUrl': None, 'profileBannerUrl': None, 'label': None, 'url': 'https://twitter.com/KremlinRussia_E'}, {'_type': 'snscrape.modules.twitter.User', 'username': 'NATO', 'id': 83795099, 'displayname': 'NATO', 'description': None, 'rawDescription': None, 'descriptionUrls': None, 'verified': None, 'created': None, 'followersCount': None, 'friendsCount': None, 'statusesCount': None, 'favouritesCount': None, 'listedCount': None, 'mediaCount': None, 'location': None, 'protected': None, 'linkUrl': None, 'linkTcourl': None, 'profileImageUrl': None, 'profileBannerUrl': None, 'label': None, 'url': 'https://twitter.com/NATO'}]",,,,
