_type,url,date,content,renderedContent,id,user,replyCount,retweetCount,likeCount,quoteCount,conversationId,lang,source,sourceUrl,sourceLabel,outlinks,tcooutlinks,media,retweetedTweet,quotedTweet,inReplyToTweetId,inReplyToUser,mentionedUsers,coordinates,place,hashtags,cashtags
snscrape.modules.twitter.Tweet,https://twitter.com/rroberthon/status/1461834741049700361,2021-11-19 23:12:16+00:00,"Ukraine, Poland, Thailand, Russia, and whoever else pretends to be in the gulf coast oil theater were speaking to the incorrect representatives. The civilized Americans are in the south. None of our insurances were for the taking. Finish us off or start paying back your debts.","Ukraine, Poland, Thailand, Russia, and whoever else pretends to be in the gulf coast oil theater were speaking to the incorrect representatives. The civilized Americans are in the south. None of our insurances were for the taking. Finish us off or start paying back your debts.",1461834741049700361,"{'_type': 'snscrape.modules.twitter.User', 'username': 'rroberthon', 'id': 1576242038, 'displayname': 'Rachelle Roberthon', 'description': 'Audit•Accounting•Compliance•Behaviorism Psychology•NeuroLinguistics•Education•M.A. Exceptional Student Education 2018•B.S. Accounting 1995', 'rawDescription': 'Audit•Accounting•Compliance•Behaviorism Psychology•NeuroLinguistics•Education•M.A. Exceptional Student Education 2018•B.S. Accounting 1995', 'descriptionUrls': None, 'verified': False, 'created': '2013-07-07T23:09:12+00:00', 'followersCount': 618, 'friendsCount': 3021, 'statusesCount': 156867, 'favouritesCount': 12835, 'listedCount': 8, 'mediaCount': 85075, 'location': 'Florida, USA', 'protected': False, 'linkUrl': None, 'linkTcourl': None, 'profileImageUrl': 'https://pbs.twimg.com/profile_images/1490850999866638337/RUjccnJl_normal.jpg', 'profileBannerUrl': 'https://pbs.twimg.com/profile_banners/1576242038/1644430186', 'label': None, 'url': 'https://twitter.com/rroberthon'}",0,0,0,0,1461833398696267790,en,"<a href=""https://mobile.twitter.com"" rel=""nofollow"">Twitter Web App</a>",https://mobile.twitter.com,Twitter Web App,,,,,,1.461834237234094e+18,"{'_type': 'snscrape.modules.twitter.User', 'username': 'rroberthon', 'id': 1576242038, 'displayname': 'Rachelle Roberthon', 'description': 'Audit•Accounting•Compliance•Behaviorism Psychology•NeuroLinguistics•Education•M.A. Exceptional Student Education 2018•B.S. Accounting 1995', 'rawDescription': 'Audit•Accounting•Compliance•Behaviorism Psychology•NeuroLinguistics•Education•M.A. Exceptional Student Education 2018•B.S. Accounting 1995', 'descriptionUrls': None, 'verified': False, 'created': '2013-07-07T23:09:12+00:00', 'followersCount': 618, 'friendsCount': 3021, 'statusesCount': 156867, 'favouritesCount': 12835, 'listedCount': 8, 'mediaCount': 85075, 'location': 'Florida, USA', 'protected': False, 'linkUrl': None, 'linkTcourl': None, 'profileImageUrl': 'https://pbs.twimg.com/profile_images/1490850999866638337/RUjccnJl_normal.jpg', 'profileBannerUrl': 'https://pbs.twimg.com/profile_banners/1576242038/1644430186', 'label': None, 'url': 'https://twitter.com/rroberthon'}",,,,,
snscrape.modules.twitter.Tweet,https://twitter.com/BULLDOZER747/status/1461833461908615171,2021-11-19 23:07:11+00:00,"We think Russia moves across the border with Ukraine for three reasons:

 Oil, Money, and Concessions.

Sort of like: 

Coke, Popcorn, and Natchos
at the movie theatre. https://t.co/RPpdGsa4uR","We think Russia moves across the border with Ukraine for three reasons:

 Oil, Money, and Concessions.

Sort of like: 

Coke, Popcorn, and Natchos
at the movie theatre. https://t.co/RPpdGsa4uR",1461833461908615171,"{'_type': 'snscrape.modules.twitter.User', 'username': 'BULLDOZER747', 'id': 1034938302, 'displayname': 'Polaris', 'description': '', 'rawDescription': '', 'descriptionUrls': None, 'verified': False, 'created': '2012-12-25T14:52:25+00:00', 'followersCount': 15, 'friendsCount': 278, 'statusesCount': 11891, 'favouritesCount': 862, 'listedCount': 0, 'mediaCount': 2339, 'location': 'Minnesota, USA', 'protected': False, 'linkUrl': None, 'linkTcourl': None, 'profileImageUrl': 'https://pbs.twimg.com/profile_images/1369808645026963459/FA2urWwI_normal.jpg', 'profileBannerUrl': 'https://pbs.twimg.com/profile_banners/1034938302/1630598106', 'label': None, 'url': 'https://twitter.com/BULLDOZER747'}",0,1,0,0,1461833461908615171,en,"<a href=""http://twitter.com/download/android"" rel=""nofollow"">Twitter for Android</a>",http://twitter.com/download/android,Twitter for Android,,,"[{'_type': 'snscrape.modules.twitter.Photo', 'previewUrl': 'https://pbs.twimg.com/media/FEl5yS_XMAImgBr?format=jpg&name=small', 'fullUrl': 'https://pbs.twimg.com/media/FEl5yS_XMAImgBr?format=jpg&name=large'}]",,,,,,,,,
snscrape.modules.twitter.Tweet,https://twitter.com/Femme_Mal/status/1461738053207212033,2021-11-19 16:48:04+00:00,Also important to keep in mind any attack on a NATO member is an attack on all NATO - cutting off oil/gas can be seen as an attack invoking NATO Article 5 requiring defensive response by NATO. Ukraine isn't in NATO but oil/gas serving NATO members flows through it from Russia.,Also important to keep in mind any attack on a NATO member is an attack on all NATO - cutting off oil/gas can be seen as an attack invoking NATO Article 5 requiring defensive response by NATO. Ukraine isn't in NATO but oil/gas serving NATO members flows through it from Russia.,1461738053207212033,"{'_type': 'snscrape.modules.twitter.User', 'username': 'Femme_Mal', 'id': 341040923, 'displayname': 'Femme Malheureuse', 'description': ""Author; hellion; post-post-futurist. Caveat lector: I tweet about writing, the arts, technology, women's and diversity issues. The personal is political."", 'rawDescription': ""Author; hellion; post-post-futurist. Caveat lector: I tweet about writing, the arts, technology, women's and diversity issues. The personal is political."", 'descriptionUrls': None, 'verified': False, 'created': '2011-07-23T18:11:19+00:00', 'followersCount': 1744, 'friendsCount': 1598, 'statusesCount': 233994, 'favouritesCount': 3756, 'listedCount': 120, 'mediaCount': 4071, 'location': 'not on a map', 'protected': False, 'linkUrl': None, 'linkTcourl': None, 'profileImageUrl': 'https://pbs.twimg.com/profile_images/1368307467965317127/ScXOFgQh_normal.jpg', 'profileBannerUrl': 'https://pbs.twimg.com/profile_banners/341040923/1615065338', 'label': None, 'url': 'https://twitter.com/Femme_Mal'}",0,0,0,0,1461736512802988036,en,"<a href=""https://mobile.twitter.com"" rel=""nofollow"">Twitter Web App</a>",https://mobile.twitter.com,Twitter Web App,,,,,,1.461738051022037e+18,"{'_type': 'snscrape.modules.twitter.User', 'username': 'Femme_Mal', 'id': 341040923, 'displayname': 'Femme Malheureuse', 'description': ""Author; hellion; post-post-futurist. Caveat lector: I tweet about writing, the arts, technology, women's and diversity issues. The personal is political."", 'rawDescription': ""Author; hellion; post-post-futurist. Caveat lector: I tweet about writing, the arts, technology, women's and diversity issues. The personal is political."", 'descriptionUrls': None, 'verified': False, 'created': '2011-07-23T18:11:19+00:00', 'followersCount': 1744, 'friendsCount': 1598, 'statusesCount': 233994, 'favouritesCount': 3756, 'listedCount': 120, 'mediaCount': 4071, 'location': 'not on a map', 'protected': False, 'linkUrl': None, 'linkTcourl': None, 'profileImageUrl': 'https://pbs.twimg.com/profile_images/1368307467965317127/ScXOFgQh_normal.jpg', 'profileBannerUrl': 'https://pbs.twimg.com/profile_banners/341040923/1615065338', 'label': None, 'url': 'https://twitter.com/Femme_Mal'}",,,,,
snscrape.modules.twitter.Tweet,https://twitter.com/im2b/status/1461689396768481290,2021-11-19 13:34:43+00:00,@YossiGestetner @gregpmiller @MZHemingway @johnpodesta &amp; let us not forget that the FBI’s largest money laundering case from the 1990’s involved Russia and Ukrainian oil companies where 3 different main individual targets were found living in 3 condos all in Trump tower. Same place Manafort moved 2 weeks after being hired in Ukraine.,@YossiGestetner @gregpmiller @MZHemingway @johnpodesta &amp; let us not forget that the FBI’s largest money laundering case from the 1990’s involved Russia and Ukrainian oil companies where 3 different main individual targets were found living in 3 condos all in Trump tower. Same place Manafort moved 2 weeks after being hired in Ukraine.,1461689396768481290,"{'_type': 'snscrape.modules.twitter.User', 'username': 'im2b', 'id': 12834972, 'displayname': 'dl willson', 'description': ""I write storycubes, film them. story innovation. NBC Spelling Sundance& ...some other stuff. heh That I have been told shouldn't go here. heh"", 'rawDescription': ""I write storycubes, film them. story innovation. NBC Spelling Sundance& ...some other stuff. heh That I have been told shouldn't go here. heh"", 'descriptionUrls': None, 'verified': False, 'created': '2008-01-29T16:35:50+00:00', 'followersCount': 2315, 'friendsCount': 2374, 'statusesCount': 164635, 'favouritesCount': 148000, 'listedCount': 278, 'mediaCount': 9857, 'location': 'Boston', 'protected': False, 'linkUrl': 'http://about.me/dlwillson', 'linkTcourl': 'https://t.co/BJSkzmvvc9', 'profileImageUrl': 'https://pbs.twimg.com/profile_images/1476291748385239041/bRDw_OlF_normal.jpg', 'profileBannerUrl': 'https://pbs.twimg.com/profile_banners/12834972/1554724870', 'label': None, 'url': 'https://twitter.com/im2b'}",2,0,0,0,1461676440622149639,en,"<a href=""http://twitter.com/download/iphone"" rel=""nofollow"">Twitter for iPhone</a>",http://twitter.com/download/iphone,Twitter for iPhone,,,,,,1.4616883000964014e+18,"{'_type': 'snscrape.modules.twitter.User', 'username': 'im2b', 'id': 12834972, 'displayname': 'dl willson', 'description': ""I write storycubes, film them. story innovation. NBC Spelling Sundance& ...some other stuff. heh That I have been told shouldn't go here. heh"", 'rawDescription': ""I write storycubes, film them. story innovation. NBC Spelling Sundance& ...some other stuff. heh That I have been told shouldn't go here. heh"", 'descriptionUrls': None, 'verified': False, 'created': '2008-01-29T16:35:50+00:00', 'followersCount': 2315, 'friendsCount': 2374, 'statusesCount': 164635, 'favouritesCount': 148000, 'listedCount': 278, 'mediaCount': 9857, 'location': 'Boston', 'protected': False, 'linkUrl': 'http://about.me/dlwillson', 'linkTcourl': 'https://t.co/BJSkzmvvc9', 'profileImageUrl': 'https://pbs.twimg.com/profile_images/1476291748385239041/bRDw_OlF_normal.jpg', 'profileBannerUrl': 'https://pbs.twimg.com/profile_banners/12834972/1554724870', 'label': None, 'url': 'https://twitter.com/im2b'}","[{'_type': 'snscrape.modules.twitter.User', 'username': 'YossiGestetner', 'id': 63525003, 'displayname': 'Yossi Gestetner', 'description': None, 'rawDescription': None, 'descriptionUrls': None, 'verified': None, 'created': None, 'followersCount': None, 'friendsCount': None, 'statusesCount': None, 'favouritesCount': None, 'listedCount': None, 'mediaCount': None, 'location': None, 'protected': None, 'linkUrl': None, 'linkTcourl': None, 'profileImageUrl': None, 'profileBannerUrl': None, 'label': None, 'url': 'https://twitter.com/YossiGestetner'}, {'_type': 'snscrape.modules.twitter.User', 'username': 'gregpmiller', 'id': 242907470, 'displayname': 'Greg Miller', 'description': None, 'rawDescription': None, 'descriptionUrls': None, 'verified': None, 'created': None, 'followersCount': None, 'friendsCount': None, 'statusesCount': None, 'favouritesCount': None, 'listedCount': None, 'mediaCount': None, 'location': None, 'protected': None, 'linkUrl': None, 'linkTcourl': None, 'profileImageUrl': None, 'profileBannerUrl': None, 'label': None, 'url': 'https://twitter.com/gregpmiller'}, {'_type': 'snscrape.modules.twitter.User', 'username': 'MZHemingway', 'id': 18005085, 'displayname': 'Mollie', 'description': None, 'rawDescription': None, 'descriptionUrls': None, 'verified': None, 'created': None, 'followersCount': None, 'friendsCount': None, 'statusesCount': None, 'favouritesCount': None, 'listedCount': None, 'mediaCount': None, 'location': None, 'protected': None, 'linkUrl': None, 'linkTcourl': None, 'profileImageUrl': None, 'profileBannerUrl': None, 'label': None, 'url': 'https://twitter.com/MZHemingway'}, {'_type': 'snscrape.modules.twitter.User', 'username': 'johnpodesta', 'id': 1071777608, 'displayname': 'John Podesta', 'description': None, 'rawDescription': None, 'descriptionUrls': None, 'verified': None, 'created': None, 'followersCount': None, 'friendsCount': None, 'statusesCount': None, 'favouritesCount': None, 'listedCount': None, 'mediaCount': None, 'location': None, 'protected': None, 'linkUrl': None, 'linkTcourl': None, 'profileImageUrl': None, 'profileBannerUrl': None, 'label': None, 'url': 'https://twitter.com/johnpodesta'}]",,,,
snscrape.modules.twitter.Tweet,https://twitter.com/DouglasLund5/status/1461687597642948609,2021-11-19 13:27:34+00:00,"I’m a Brit living in Czechia, I sympathize with Brits living in UK. I’ve lived in South Africa &amp; Russia also. Don’t understand this Russophobia at all, I saw how US tried to Pillage Russia’s Oil and Continue Belligerence, today. Had an Office in Ukraine, worked with Mafia there. https://t.co/2hv6Y3AE2V","I’m a Brit living in Czechia, I sympathize with Brits living in UK. I’ve lived in South Africa &amp; Russia also. Don’t understand this Russophobia at all, I saw how US tried to Pillage Russia’s Oil and Continue Belligerence, today. Had an Office in Ukraine, worked with Mafia there. twitter.com/narysestorey/s…",1461687597642948609,"{'_type': 'snscrape.modules.twitter.User', 'username': 'DouglasLund5', 'id': 713817204274372609, 'displayname': 'Douglas Lund', 'description': 'Educated Durham & Newcastle, lived in Iran, Afghanistan, Greece Libya,Nigeria, USA, Russia, Czech Republic, Uzbekistan, S.Africa Never Took or Gave Bribe', 'rawDescription': 'Educated Durham & Newcastle, lived in Iran, Afghanistan, Greece Libya,Nigeria, USA, Russia, Czech Republic, Uzbekistan, https://t.co/pQHqRMwHFk Never Took or Gave Bribe', 'descriptionUrls': [{'text': 'S.Africa', 'url': 'http://S.Africa', 'tcourl': 'https://t.co/pQHqRMwHFk', 'indices': [120, 143]}], 'verified': False, 'created': '2016-03-26T19:57:38+00:00', 'followersCount': 1405, 'friendsCount': 2983, 'statusesCount': 9816, 'favouritesCount': 3013, 'listedCount': 3, 'mediaCount': 977, 'location': 'Prague, Czech Republic', 'protected': False, 'linkUrl': None, 'linkTcourl': None, 'profileImageUrl': 'https://pbs.twimg.com/profile_images/979012321166098432/5uxSbNEf_normal.jpg', 'profileBannerUrl': None, 'label': None, 'url': 'https://twitter.com/DouglasLund5'}",0,0,0,0,1461687597642948609,en,"<a href=""http://twitter.com/download/iphone"" rel=""nofollow"">Twitter for iPhone</a>",http://twitter.com/download/iphone,Twitter for iPhone,['https://twitter.com/narysestorey/status/1461582393807101953'],['https://t.co/2hv6Y3AE2V'],,,"{'_type': 'snscrape.modules.twitter.Tweet', 'url': 'https://twitter.com/narysestorey/status/1461582393807101953', 'date': '2021-11-19T06:29:32+00:00', 'content': 'We’ve reached another #FollowBackFriday folks! If you’re proud to be European, want the Tories out and want Government reform, plse retweet and follow - I’ll follow back. Let’s build this movement!', 'renderedContent': 'We’ve reached another #FollowBackFriday folks! If you’re proud to be European, want the Tories out and want Government reform, plse retweet and follow - I’ll follow back. Let’s build this movement!', 'id': 1461582393807101953, 'user': {'_type': 'snscrape.modules.twitter.User', 'username': 'narysestorey', 'id': 3817733806, 'displayname': 'Naryse 🌻', 'description': 'He won’t stop until he’s stopped. One nation can’t stop him and he won’t stop with one nation. 🇺🇦', 'rawDescription': 'He won’t stop until he’s stopped. One nation can’t stop him and he won’t stop with one nation. 🇺🇦', 'descriptionUrls': None, 'verified': False, 'created': '2015-09-29T20:04:19+00:00', 'followersCount': 6210, 'friendsCount': 6517, 'statusesCount': 970, 'favouritesCount': 2746, 'listedCount': 0, 'mediaCount': 7, 'location': '', 'protected': False, 'linkUrl': None, 'linkTcourl': None, 'profileImageUrl': 'https://pbs.twimg.com/profile_images/1351971437167452162/o_ZNJm_y_normal.jpg', 'profileBannerUrl': None, 'label': None, 'url': 'https://twitter.com/narysestorey'}, 'replyCount': 187, 'retweetCount': 918, 'likeCount': 1551, 'quoteCount': 26, 'conversationId': 1461582393807101953, 'lang': 'en', 'source': '<a href=""http://twitter.com/download/iphone"" rel=""nofollow"">Twitter for iPhone</a>', 'sourceUrl': 'http://twitter.com/download/iphone', 'sourceLabel': 'Twitter for iPhone', 'outlinks': None, 'tcooutlinks': None, 'media': None, 'retweetedTweet': None, 'quotedTweet': None, 'inReplyToTweetId': None, 'inReplyToUser': None, 'mentionedUsers': None, 'coordinates': None, 'place': None, 'hashtags': ['FollowBackFriday'], 'cashtags': None}",,,,,,,
