_type,url,date,content,renderedContent,id,user,replyCount,retweetCount,likeCount,quoteCount,conversationId,lang,source,sourceUrl,sourceLabel,outlinks,tcooutlinks,media,retweetedTweet,quotedTweet,inReplyToTweetId,inReplyToUser,mentionedUsers,coordinates,place,hashtags,cashtags
snscrape.modules.twitter.Tweet,https://twitter.com/QuetzalThoughts/status/1463244431847424003,2021-11-23 20:33:52+00:00,"@eigenrobot If only we had a military pact with our close allies in the EU &amp; they actually had incentives not to just let Russia trample their zones of influence in exchange for cheap oil, this could be prevented. Too bad no such thing exists and Ukraine's future lies solely on our hands.","@eigenrobot If only we had a military pact with our close allies in the EU &amp; they actually had incentives not to just let Russia trample their zones of influence in exchange for cheap oil, this could be prevented. Too bad no such thing exists and Ukraine's future lies solely on our hands.",1463244431847424003,"{'_type': 'snscrape.modules.twitter.User', 'username': 'QuetzalThoughts', 'id': 1100495923522592768, 'displayname': 'Quetzal Flying To New Horizons', 'description': 'If only you knew how bad things really are, we could fix them together.', 'rawDescription': 'If only you knew how bad things really are, we could fix them together.', 'descriptionUrls': None, 'verified': False, 'created': '2019-02-26T20:40:49+00:00', 'followersCount': 565, 'friendsCount': 1874, 'statusesCount': 23698, 'favouritesCount': 41942, 'listedCount': 8, 'mediaCount': 616, 'location': 'Not Twitter :(', 'protected': False, 'linkUrl': None, 'linkTcourl': None, 'profileImageUrl': 'https://pbs.twimg.com/profile_images/1454552649701859328/CCLvbT74_normal.jpg', 'profileBannerUrl': 'https://pbs.twimg.com/profile_banners/1100495923522592768/1597203241', 'label': None, 'url': 'https://twitter.com/QuetzalThoughts'}",2,0,6,0,1463242181141880833,en,"<a href=""http://twitter.com/download/android"" rel=""nofollow"">Twitter for Android</a>",http://twitter.com/download/android,Twitter for Android,,,,,,1.4632421811418808e+18,"{'_type': 'snscrape.modules.twitter.User', 'username': 'eigenrobot', 'id': 1584642529, 'displayname': 'eigenrobot', 'description': None, 'rawDescription': None, 'descriptionUrls': None, 'verified': None, 'created': None, 'followersCount': None, 'friendsCount': None, 'statusesCount': None, 'favouritesCount': None, 'listedCount': None, 'mediaCount': None, 'location': None, 'protected': None, 'linkUrl': None, 'linkTcourl': None, 'profileImageUrl': None, 'profileBannerUrl': None, 'label': None, 'url': 'https://twitter.com/eigenrobot'}","[{'_type': 'snscrape.modules.twitter.User', 'username': 'eigenrobot', 'id': 1584642529, 'displayname': 'eigenrobot', 'description': None, 'rawDescription': None, 'descriptionUrls': None, 'verified': None, 'created': None, 'followersCount': None, 'friendsCount': None, 'statusesCount': None, 'favouritesCount': None, 'listedCount': None, 'mediaCount': None, 'location': None, 'protected': None, 'linkUrl': None, 'linkTcourl': None, 'profileImageUrl': None, 'profileBannerUrl': None, 'label': None, 'url': 'https://twitter.com/eigenrobot'}]",,,,
snscrape.modules.twitter.Tweet,https://twitter.com/RKitenplon/status/1463232334375833613,2021-11-23 19:45:48+00:00,"raiding the strategic oil reserves mean less fuel available for our military should they need to defend against an attack here or abroad... i.e., china attacking taiwan...Russia/ Ukraine? this is by design to make sure we can't fight backl https://t.co/B5gmuGMnZK","raiding the strategic oil reserves mean less fuel available for our military should they need to defend against an attack here or abroad... i.e., china attacking taiwan...Russia/ Ukraine? this is by design to make sure we can't fight backl twitter.com/KatiePavlich/s…",1463232334375833613,"{'_type': 'snscrape.modules.twitter.User', 'username': 'RKitenplon', 'id': 489955111, 'displayname': 'Rita Kitenplon', 'description': 'Former radio personality , Journalist, Blogger, Media Marketing Maven. God bless America!', 'rawDescription': 'Former radio personality , Journalist, Blogger, Media Marketing Maven. God bless America!', 'descriptionUrls': None, 'verified': False, 'created': '2012-02-12T02:42:10+00:00', 'followersCount': 1814, 'friendsCount': 1392, 'statusesCount': 84340, 'favouritesCount': 31726, 'listedCount': 17, 'mediaCount': 6, 'location': '', 'protected': False, 'linkUrl': None, 'linkTcourl': None, 'profileImageUrl': 'https://pbs.twimg.com/profile_images/378800000699682693/424271aec89b479836e6ac52a7f00ecd_normal.jpeg', 'profileBannerUrl': None, 'label': None, 'url': 'https://twitter.com/RKitenplon'}",0,1,2,0,1463232334375833613,en,"<a href=""https://mobile.twitter.com"" rel=""nofollow"">Twitter Web App</a>",https://mobile.twitter.com,Twitter Web App,['https://twitter.com/KatiePavlich/status/1463224344172122112'],['https://t.co/B5gmuGMnZK'],,,"{'_type': 'snscrape.modules.twitter.Tweet', 'url': 'https://twitter.com/KatiePavlich/status/1463224344172122112', 'date': '2021-11-23T19:14:03+00:00', 'content': 'Going to be awesome when Biden taps the strategic oil reserve, which will only cause another crisis of a depleted oil reserve and make the U.S. even more vulnerable, while doing nothing to lower gas prices. Yay.', 'renderedContent': 'Going to be awesome when Biden taps the strategic oil reserve, which will only cause another crisis of a depleted oil reserve and make the U.S. even more vulnerable, while doing nothing to lower gas prices. Yay.', 'id': 1463224344172122112, 'user': {'_type': 'snscrape.modules.twitter.User', 'username': 'KatiePavlich', 'id': 48459553, 'displayname': 'Katie Pavlich', 'description': 'Proud American 🇺🇸 Don’t panic! Retweets are probably endorsements.“The road to hell is paved with good intentions.”', 'rawDescription': 'Proud American 🇺🇸 Don’t panic! Retweets are probably endorsements.“The road to hell is paved with good intentions.”', 'descriptionUrls': None, 'verified': True, 'created': '2009-06-18T19:29:32+00:00', 'followersCount': 939951, 'friendsCount': 1999, 'statusesCount': 55169, 'favouritesCount': 17696, 'listedCount': 4430, 'mediaCount': 2315, 'location': 'On Instagram/Off Twitter wknds', 'protected': False, 'linkUrl': 'http://www.katiepavlich.com/', 'linkTcourl': 'https://t.co/Aaf1R2Ug0j', 'profileImageUrl': 'https://pbs.twimg.com/profile_images/1493939217164115970/1vLQ140D_normal.jpg', 'profileBannerUrl': 'https://pbs.twimg.com/profile_banners/48459553/1643949526', 'label': None, 'url': 'https://twitter.com/KatiePavlich'}, 'replyCount': 719, 'retweetCount': 2851, 'likeCount': 15460, 'quoteCount': 188, 'conversationId': 1463224344172122112, 'lang': 'en', 'source': '<a href=""http://twitter.com/download/iphone"" rel=""nofollow"">Twitter for iPhone</a>', 'sourceUrl': 'http://twitter.com/download/iphone', 'sourceLabel': 'Twitter for iPhone', 'outlinks': None, 'tcooutlinks': None, 'media': None, 'retweetedTweet': None, 'quotedTweet': None, 'inReplyToTweetId': None, 'inReplyToUser': None, 'mentionedUsers': None, 'coordinates': None, 'place': None, 'hashtags': None, 'cashtags': None}",,,,,,,
snscrape.modules.twitter.Tweet,https://twitter.com/BrownietheElf07/status/1463226834095689732,2021-11-23 19:23:57+00:00,"@TheInsiderPaper Here you go China, you get our cheap oil… we’ll pay the premium from Russia and Ukraine!","@TheInsiderPaper Here you go China, you get our cheap oil… we’ll pay the premium from Russia and Ukraine!",1463226834095689732,"{'_type': 'snscrape.modules.twitter.User', 'username': 'BrownietheElf07', 'id': 1407357100637003790, 'displayname': 'President BrownsFan', 'description': '', 'rawDescription': '', 'descriptionUrls': None, 'verified': False, 'created': '2021-06-22T15:17:46+00:00', 'followersCount': 266, 'friendsCount': 456, 'statusesCount': 3361, 'favouritesCount': 4011, 'listedCount': 0, 'mediaCount': 492, 'location': '', 'protected': False, 'linkUrl': None, 'linkTcourl': None, 'profileImageUrl': 'https://pbs.twimg.com/profile_images/1517585111956570113/nYZUKw-g_normal.jpg', 'profileBannerUrl': 'https://pbs.twimg.com/profile_banners/1407357100637003790/1641173409', 'label': None, 'url': 'https://twitter.com/BrownietheElf07'}",0,1,4,0,1463225875407716360,en,"<a href=""http://twitter.com/download/iphone"" rel=""nofollow"">Twitter for iPhone</a>",http://twitter.com/download/iphone,Twitter for iPhone,,,,,,1.4632258754077164e+18,"{'_type': 'snscrape.modules.twitter.User', 'username': 'TheInsiderPaper', 'id': 1247223374717296647, 'displayname': 'Insider Paper', 'description': None, 'rawDescription': None, 'descriptionUrls': None, 'verified': None, 'created': None, 'followersCount': None, 'friendsCount': None, 'statusesCount': None, 'favouritesCount': None, 'listedCount': None, 'mediaCount': None, 'location': None, 'protected': None, 'linkUrl': None, 'linkTcourl': None, 'profileImageUrl': None, 'profileBannerUrl': None, 'label': None, 'url': 'https://twitter.com/TheInsiderPaper'}","[{'_type': 'snscrape.modules.twitter.User', 'username': 'TheInsiderPaper', 'id': 1247223374717296647, 'displayname': 'Insider Paper', 'description': None, 'rawDescription': None, 'descriptionUrls': None, 'verified': None, 'created': None, 'followersCount': None, 'friendsCount': None, 'statusesCount': None, 'favouritesCount': None, 'listedCount': None, 'mediaCount': None, 'location': None, 'protected': None, 'linkUrl': None, 'linkTcourl': None, 'profileImageUrl': None, 'profileBannerUrl': None, 'label': None, 'url': 'https://twitter.com/TheInsiderPaper'}]",,,,
snscrape.modules.twitter.Tweet,https://twitter.com/DillonZwick/status/1463224272722305025,2021-11-23 19:13:46+00:00,"Russia: we're going to attack Ukraine.

US: hold on a minute, let me drain our strategic oil reserves first because the oil markets have gotten too spicy","Russia: we're going to attack Ukraine.

US: hold on a minute, let me drain our strategic oil reserves first because the oil markets have gotten too spicy",1463224272722305025,"{'_type': 'snscrape.modules.twitter.User', 'username': 'DillonZwick', 'id': 613494134, 'displayname': 'Dillon Zwick', 'description': ""Management Consultant- 50% Finance, Economics, Geopolitics, Bankruptcy,\nTurnarounds & Restructurings. and 50% me complaining about bad design. reply y'all."", 'rawDescription': ""Management Consultant- 50% Finance, Economics, Geopolitics, Bankruptcy,\nTurnarounds & Restructurings. and 50% me complaining about bad design. reply y'all."", 'descriptionUrls': None, 'verified': False, 'created': '2012-06-20T14:49:10+00:00', 'followersCount': 106, 'friendsCount': 660, 'statusesCount': 722, 'favouritesCount': 11494, 'listedCount': 2, 'mediaCount': 14, 'location': 'Austin, Texas', 'protected': False, 'linkUrl': None, 'linkTcourl': None, 'profileImageUrl': 'https://pbs.twimg.com/profile_images/1263473787141599235/5Ej9FywH_normal.jpg', 'profileBannerUrl': 'https://pbs.twimg.com/profile_banners/613494134/1597786431', 'label': None, 'url': 'https://twitter.com/DillonZwick'}",0,0,0,0,1463224272722305025,en,"<a href=""http://twitter.com/download/android"" rel=""nofollow"">Twitter for Android</a>",http://twitter.com/download/android,Twitter for Android,,,,,,,,,,,,
snscrape.modules.twitter.Tweet,https://twitter.com/EekGadsden/status/1463127727712706562,2021-11-23 12:50:08+00:00,"Russia us about to invade Ukraine, China has all but it overtaken Taiwan and Crazy Joe wants to deplete the strategic oil reserve","Russia us about to invade Ukraine, China has all but it overtaken Taiwan and Crazy Joe wants to deplete the strategic oil reserve",1463127727712706562,"{'_type': 'snscrape.modules.twitter.User', 'username': 'EekGadsden', 'id': 1463123049562222595, 'displayname': 'Eek Gadsden', 'description': 'Business owner, pickup truck driver, asian food connoisseur', 'rawDescription': 'Business owner, pickup truck driver, asian food connoisseur', 'descriptionUrls': None, 'verified': False, 'created': '2021-11-23T12:31:50+00:00', 'followersCount': 122, 'friendsCount': 330, 'statusesCount': 173, 'favouritesCount': 73, 'listedCount': 0, 'mediaCount': 2, 'location': '', 'protected': False, 'linkUrl': None, 'linkTcourl': None, 'profileImageUrl': 'https://pbs.twimg.com/profile_images/1463123189089898505/z8NnXTfM_normal.jpg', 'profileBannerUrl': None, 'label': None, 'url': 'https://twitter.com/EekGadsden'}",0,0,1,0,1463127727712706562,en,"<a href=""http://twitter.com/download/iphone"" rel=""nofollow"">Twitter for iPhone</a>",http://twitter.com/download/iphone,Twitter for iPhone,,,,,,,,,,,,
snscrape.modules.twitter.Tweet,https://twitter.com/muthonikamau18/status/1463120347142795266,2021-11-23 12:20:48+00:00,"They don't want Hillary poking Russia in Ukraine and poking China in Taiwan and they don't have oil, they don't have food but who is Hillary to be told. She wants to attack Russia using Ukraine. She wants to attack China using Taiwan.","They don't want Hillary poking Russia in Ukraine and poking China in Taiwan and they don't have oil, they don't have food but who is Hillary to be told. She wants to attack Russia using Ukraine. She wants to attack China using Taiwan.",1463120347142795266,"{'_type': 'snscrape.modules.twitter.User', 'username': 'muthonikamau18', 'id': 886290094877028354, 'displayname': 'On behalf of the child of the universe', 'description': '', 'rawDescription': '', 'descriptionUrls': None, 'verified': False, 'created': '2017-07-15T18:23:19+00:00', 'followersCount': 90, 'friendsCount': 47, 'statusesCount': 26818, 'favouritesCount': 894, 'listedCount': 0, 'mediaCount': 53, 'location': '', 'protected': False, 'linkUrl': None, 'linkTcourl': None, 'profileImageUrl': 'https://pbs.twimg.com/profile_images/1457402691693465615/VQAUcrEt_normal.jpg', 'profileBannerUrl': None, 'label': None, 'url': 'https://twitter.com/muthonikamau18'}",0,2,5,0,1463120345238581254,en,"<a href=""http://twitter.com/download/android"" rel=""nofollow"">Twitter for Android</a>",http://twitter.com/download/android,Twitter for Android,,,,,,1.4631203452385812e+18,"{'_type': 'snscrape.modules.twitter.User', 'username': 'muthonikamau18', 'id': 886290094877028354, 'displayname': 'On behalf of the child of the universe', 'description': '', 'rawDescription': '', 'descriptionUrls': None, 'verified': False, 'created': '2017-07-15T18:23:19+00:00', 'followersCount': 90, 'friendsCount': 47, 'statusesCount': 26818, 'favouritesCount': 894, 'listedCount': 0, 'mediaCount': 53, 'location': '', 'protected': False, 'linkUrl': None, 'linkTcourl': None, 'profileImageUrl': 'https://pbs.twimg.com/profile_images/1457402691693465615/VQAUcrEt_normal.jpg', 'profileBannerUrl': None, 'label': None, 'url': 'https://twitter.com/muthonikamau18'}",,,,,
snscrape.modules.twitter.Tweet,https://twitter.com/mnskymoment/status/1463080249638506501,2021-11-23 09:41:28+00:00,"ok, lets assume that Russia plans to invade in Ukraine, what is not true with 99% prob, where oil should trade than","ok, lets assume that Russia plans to invade in Ukraine, what is not true with 99% prob, where oil should trade than",1463080249638506501,"{'_type': 'snscrape.modules.twitter.User', 'username': 'mnskymoment', 'id': 824164968677408769, 'displayname': 'minsky', 'description': 'Equity strategy. Macro. Special situations. Highly controversial. Constantly looking for abnormal distributions.', 'rawDescription': 'Equity strategy. Macro. Special situations. Highly controversial. Constantly looking for abnormal distributions.', 'descriptionUrls': None, 'verified': False, 'created': '2017-01-25T08:00:15+00:00', 'followersCount': 2880, 'friendsCount': 217, 'statusesCount': 8103, 'favouritesCount': 5037, 'listedCount': 56, 'mediaCount': 1829, 'location': 'Death Star', 'protected': False, 'linkUrl': None, 'linkTcourl': None, 'profileImageUrl': 'https://pbs.twimg.com/profile_images/1451177810794532865/RbLgmX4-_normal.jpg', 'profileBannerUrl': 'https://pbs.twimg.com/profile_banners/824164968677408769/1641717662', 'label': None, 'url': 'https://twitter.com/mnskymoment'}",6,0,19,0,1463080249638506501,en,"<a href=""http://twitter.com/#!/download/ipad"" rel=""nofollow"">Twitter for iPad</a>",http://twitter.com/#!/download/ipad,Twitter for iPad,,,,,,,,,,,,
snscrape.modules.twitter.Tweet,https://twitter.com/t2meg/status/1463071351279964161,2021-11-23 09:06:07+00:00,"@ElenaChernenko @McFaul Putin invaded Ukraine TWICE to avoid taxes on the oil pipelines. Now he’s behind the immigrant warfare in Belarus. Putin poisons and murders his detractors. The world, and Russia, would be much better without Putin in it.","@ElenaChernenko @McFaul Putin invaded Ukraine TWICE to avoid taxes on the oil pipelines. Now he’s behind the immigrant warfare in Belarus. Putin poisons and murders his detractors. The world, and Russia, would be much better without Putin in it.",1463071351279964161,"{'_type': 'snscrape.modules.twitter.User', 'username': 't2meg', 'id': 795632410650087424, 'displayname': 'Vote Democrat.', 'description': 'An open mind is the best kind', 'rawDescription': 'An open mind is the best kind', 'descriptionUrls': None, 'verified': False, 'created': '2016-11-07T14:22:03+00:00', 'followersCount': 587, 'friendsCount': 957, 'statusesCount': 30477, 'favouritesCount': 29350, 'listedCount': 4, 'mediaCount': 382, 'location': 'Arkansas, USA', 'protected': False, 'linkUrl': None, 'linkTcourl': None, 'profileImageUrl': 'https://pbs.twimg.com/profile_images/1373345855676280839/FvV0MnpF_normal.jpg', 'profileBannerUrl': 'https://pbs.twimg.com/profile_banners/795632410650087424/1602605583', 'label': None, 'url': 'https://twitter.com/t2meg'}",0,0,0,0,1463055499901825026,en,"<a href=""http://twitter.com/download/iphone"" rel=""nofollow"">Twitter for iPhone</a>",http://twitter.com/download/iphone,Twitter for iPhone,,,,,,1.463057275652825e+18,"{'_type': 'snscrape.modules.twitter.User', 'username': 'ElenaChernenko', 'id': 220476691, 'displayname': 'Elena Chernenko', 'description': None, 'rawDescription': None, 'descriptionUrls': None, 'verified': None, 'created': None, 'followersCount': None, 'friendsCount': None, 'statusesCount': None, 'favouritesCount': None, 'listedCount': None, 'mediaCount': None, 'location': None, 'protected': None, 'linkUrl': None, 'linkTcourl': None, 'profileImageUrl': None, 'profileBannerUrl': None, 'label': None, 'url': 'https://twitter.com/ElenaChernenko'}","[{'_type': 'snscrape.modules.twitter.User', 'username': 'ElenaChernenko', 'id': 220476691, 'displayname': 'Elena Chernenko', 'description': None, 'rawDescription': None, 'descriptionUrls': None, 'verified': None, 'created': None, 'followersCount': None, 'friendsCount': None, 'statusesCount': None, 'favouritesCount': None, 'listedCount': None, 'mediaCount': None, 'location': None, 'protected': None, 'linkUrl': None, 'linkTcourl': None, 'profileImageUrl': None, 'profileBannerUrl': None, 'label': None, 'url': 'https://twitter.com/ElenaChernenko'}, {'_type': 'snscrape.modules.twitter.User', 'username': 'McFaul', 'id': 454099919, 'displayname': 'Michael McFaul', 'description': None, 'rawDescription': None, 'descriptionUrls': None, 'verified': None, 'created': None, 'followersCount': None, 'friendsCount': None, 'statusesCount': None, 'favouritesCount': None, 'listedCount': None, 'mediaCount': None, 'location': None, 'protected': None, 'linkUrl': None, 'linkTcourl': None, 'profileImageUrl': None, 'profileBannerUrl': None, 'label': None, 'url': 'https://twitter.com/McFaul'}]",,,,
snscrape.modules.twitter.Tweet,https://twitter.com/WesternPolitics/status/1462946788760031234,2021-11-23 00:51:09+00:00,"@SheriffErwin Russia is going to invade Ukraine. I am certain they will shut off the oil to Western Europe while all that happens.

China will go after Taiwan at the same time. Our pharmaceuticals are still made there.","@SheriffErwin Russia is going to invade Ukraine. I am certain they will shut off the oil to Western Europe while all that happens.

China will go after Taiwan at the same time. Our pharmaceuticals are still made there.",1462946788760031234,"{'_type': 'snscrape.modules.twitter.User', 'username': 'WesternPolitics', 'id': 1334849441992466432, 'displayname': 'WesternPolitics', 'description': '', 'rawDescription': '', 'descriptionUrls': None, 'verified': False, 'created': '2020-12-04T13:18:36+00:00', 'followersCount': 303, 'friendsCount': 791, 'statusesCount': 7885, 'favouritesCount': 2262, 'listedCount': 5, 'mediaCount': 2135, 'location': '', 'protected': False, 'linkUrl': None, 'linkTcourl': None, 'profileImageUrl': 'https://pbs.twimg.com/profile_images/1334878729655431170/yWTeLffw_normal.jpg', 'profileBannerUrl': 'https://pbs.twimg.com/profile_banners/1334849441992466432/1646543464', 'label': None, 'url': 'https://twitter.com/WesternPolitics'}",0,0,3,0,1462910662770888711,en,"<a href=""http://twitter.com/download/iphone"" rel=""nofollow"">Twitter for iPhone</a>",http://twitter.com/download/iphone,Twitter for iPhone,,,,,,1.4629106627708887e+18,"{'_type': 'snscrape.modules.twitter.User', 'username': 'SheriffErwin', 'id': 24419870, 'displayname': 'George H Erwin, Jr.', 'description': None, 'rawDescription': None, 'descriptionUrls': None, 'verified': None, 'created': None, 'followersCount': None, 'friendsCount': None, 'statusesCount': None, 'favouritesCount': None, 'listedCount': None, 'mediaCount': None, 'location': None, 'protected': None, 'linkUrl': None, 'linkTcourl': None, 'profileImageUrl': None, 'profileBannerUrl': None, 'label': None, 'url': 'https://twitter.com/SheriffErwin'}","[{'_type': 'snscrape.modules.twitter.User', 'username': 'SheriffErwin', 'id': 24419870, 'displayname': 'George H Erwin, Jr.', 'description': None, 'rawDescription': None, 'descriptionUrls': None, 'verified': None, 'created': None, 'followersCount': None, 'friendsCount': None, 'statusesCount': None, 'favouritesCount': None, 'listedCount': None, 'mediaCount': None, 'location': None, 'protected': None, 'linkUrl': None, 'linkTcourl': None, 'profileImageUrl': None, 'profileBannerUrl': None, 'label': None, 'url': 'https://twitter.com/SheriffErwin'}]",,,,
