_type,url,date,content,renderedContent,id,user,replyCount,retweetCount,likeCount,quoteCount,conversationId,lang,source,sourceUrl,sourceLabel,outlinks,tcooutlinks,media,retweetedTweet,quotedTweet,inReplyToTweetId,inReplyToUser,mentionedUsers,coordinates,place,hashtags,cashtags
snscrape.modules.twitter.Tweet,https://twitter.com/simonandyas/status/1459294009604689920,2021-11-12 22:56:18+00:00,@Nigelgd1 @nickfshort What's the strategic value of Ukraine to Russia? Grain? Oil? Buffer v West? Warm sea port?,@Nigelgd1 @nickfshort What's the strategic value of Ukraine to Russia? Grain? Oil? Buffer v West? Warm sea port?,1459294009604689920,"{'_type': 'snscrape.modules.twitter.User', 'username': 'simonandyas', 'id': 399057020, 'displayname': 'simon bennett', 'description': '', 'rawDescription': '', 'descriptionUrls': None, 'verified': False, 'created': '2011-10-26T22:50:02+00:00', 'followersCount': 63, 'friendsCount': 89, 'statusesCount': 3878, 'favouritesCount': 1480, 'listedCount': 2, 'mediaCount': 174, 'location': '', 'protected': False, 'linkUrl': None, 'linkTcourl': None, 'profileImageUrl': 'https://pbs.twimg.com/profile_images/899680646800584704/nmiBKrpW_normal.jpg', 'profileBannerUrl': 'https://pbs.twimg.com/profile_banners/399057020/1477512950', 'label': None, 'url': 'https://twitter.com/simonandyas'}",0,0,0,0,1459283393162756100,en,"<a href=""http://twitter.com/download/android"" rel=""nofollow"">Twitter for Android</a>",http://twitter.com/download/android,Twitter for Android,,,,,,1.459283393162756e+18,"{'_type': 'snscrape.modules.twitter.User', 'username': 'Nigelgd1', 'id': 2297587866, 'displayname': 'Nigel Gould-Davies', 'description': None, 'rawDescription': None, 'descriptionUrls': None, 'verified': None, 'created': None, 'followersCount': None, 'friendsCount': None, 'statusesCount': None, 'favouritesCount': None, 'listedCount': None, 'mediaCount': None, 'location': None, 'protected': None, 'linkUrl': None, 'linkTcourl': None, 'profileImageUrl': None, 'profileBannerUrl': None, 'label': None, 'url': 'https://twitter.com/Nigelgd1'}","[{'_type': 'snscrape.modules.twitter.User', 'username': 'Nigelgd1', 'id': 2297587866, 'displayname': 'Nigel Gould-Davies', 'description': None, 'rawDescription': None, 'descriptionUrls': None, 'verified': None, 'created': None, 'followersCount': None, 'friendsCount': None, 'statusesCount': None, 'favouritesCount': None, 'listedCount': None, 'mediaCount': None, 'location': None, 'protected': None, 'linkUrl': None, 'linkTcourl': None, 'profileImageUrl': None, 'profileBannerUrl': None, 'label': None, 'url': 'https://twitter.com/Nigelgd1'}, {'_type': 'snscrape.modules.twitter.User', 'username': 'nickfshort', 'id': 222779550, 'displayname': 'Nick Short 🇺🇦', 'description': None, 'rawDescription': None, 'descriptionUrls': None, 'verified': None, 'created': None, 'followersCount': None, 'friendsCount': None, 'statusesCount': None, 'favouritesCount': None, 'listedCount': None, 'mediaCount': None, 'location': None, 'protected': None, 'linkUrl': None, 'linkTcourl': None, 'profileImageUrl': None, 'profileBannerUrl': None, 'label': None, 'url': 'https://twitter.com/nickfshort'}]",,,,
snscrape.modules.twitter.Tweet,https://twitter.com/MuesforMontana/status/1459244336621580289,2021-11-12 19:38:55+00:00,"You may have heard something about a potential Russian invasion of Ukraine and brushed it off, as what are the odds of that?

But, historically, Russia invades countries when oil and/or natural gas prices are particularly high.  See invasion of Georgia in 2008, pre-crash, when","You may have heard something about a potential Russian invasion of Ukraine and brushed it off, as what are the odds of that?

But, historically, Russia invades countries when oil and/or natural gas prices are particularly high.  See invasion of Georgia in 2008, pre-crash, when",1459244336621580289,"{'_type': 'snscrape.modules.twitter.User', 'username': 'MuesforMontana', 'id': 1129189487639089152, 'displayname': 'John Mues', 'description': 'Entrepreneur (ex-Corporate). 2020 US Sen Cand. US Navy Vet. Ex-teacher in Indigenous community. U.S. Naval Academy + London Business School', 'rawDescription': 'Entrepreneur (ex-Corporate). 2020 US Sen Cand. US Navy Vet. Ex-teacher in Indigenous community. U.S. Naval Academy + London Business School', 'descriptionUrls': None, 'verified': True, 'created': '2019-05-17T00:58:47+00:00', 'followersCount': 8108, 'friendsCount': 982, 'statusesCount': 1780, 'favouritesCount': 1091, 'listedCount': 54, 'mediaCount': 170, 'location': 'Montana, USA', 'protected': False, 'linkUrl': 'http://afghanevachelp.org', 'linkTcourl': 'https://t.co/aVr9tZnoxX', 'profileImageUrl': 'https://pbs.twimg.com/profile_images/1129194034574966784/FilclLum_normal.png', 'profileBannerUrl': 'https://pbs.twimg.com/profile_banners/1129189487639089152/1560295473', 'label': None, 'url': 'https://twitter.com/MuesforMontana'}",1,0,12,1,1459244336621580289,en,"<a href=""http://twitter.com/download/iphone"" rel=""nofollow"">Twitter for iPhone</a>",http://twitter.com/download/iphone,Twitter for iPhone,,,,,,,,,,,,
snscrape.modules.twitter.Tweet,https://twitter.com/JoshuaG73440804/status/1459237241226772485,2021-11-12 19:10:44+00:00,@guiltydog1 @EndGameWW3 Two major reason it gives Russia more control over oil heading to eastern Europe and NATO is a security delimma and if Ukraine joins NATO Russia has two fronts it's would have to consider defending from the north European plain (Poland) and southern pass Crimea (Ukraine),@guiltydog1 @EndGameWW3 Two major reason it gives Russia more control over oil heading to eastern Europe and NATO is a security delimma and if Ukraine joins NATO Russia has two fronts it's would have to consider defending from the north European plain (Poland) and southern pass Crimea (Ukraine),1459237241226772485,"{'_type': 'snscrape.modules.twitter.User', 'username': 'JoshuaG73440804', 'id': 1388086288482504713, 'displayname': 'Joshua Green', 'description': 'Foreign policy hobbyist and all around jerk', 'rawDescription': 'Foreign policy hobbyist and all around jerk', 'descriptionUrls': None, 'verified': False, 'created': '2021-04-30T11:02:38+00:00', 'followersCount': 4, 'friendsCount': 25, 'statusesCount': 265, 'favouritesCount': 175, 'listedCount': 0, 'mediaCount': 2, 'location': '', 'protected': False, 'linkUrl': None, 'linkTcourl': None, 'profileImageUrl': 'https://abs.twimg.com/sticky/default_profile_images/default_profile_normal.png', 'profileBannerUrl': None, 'label': None, 'url': 'https://twitter.com/JoshuaG73440804'}",1,0,1,0,1459220161333018628,en,"<a href=""http://twitter.com/download/android"" rel=""nofollow"">Twitter for Android</a>",http://twitter.com/download/android,Twitter for Android,,,,,,1.459221635978961e+18,"{'_type': 'snscrape.modules.twitter.User', 'username': 'guiltydog1', 'id': 1297404196015288320, 'displayname': 'guiltydog', 'description': None, 'rawDescription': None, 'descriptionUrls': None, 'verified': None, 'created': None, 'followersCount': None, 'friendsCount': None, 'statusesCount': None, 'favouritesCount': None, 'listedCount': None, 'mediaCount': None, 'location': None, 'protected': None, 'linkUrl': None, 'linkTcourl': None, 'profileImageUrl': None, 'profileBannerUrl': None, 'label': None, 'url': 'https://twitter.com/guiltydog1'}","[{'_type': 'snscrape.modules.twitter.User', 'username': 'guiltydog1', 'id': 1297404196015288320, 'displayname': 'guiltydog', 'description': None, 'rawDescription': None, 'descriptionUrls': None, 'verified': None, 'created': None, 'followersCount': None, 'friendsCount': None, 'statusesCount': None, 'favouritesCount': None, 'listedCount': None, 'mediaCount': None, 'location': None, 'protected': None, 'linkUrl': None, 'linkTcourl': None, 'profileImageUrl': None, 'profileBannerUrl': None, 'label': None, 'url': 'https://twitter.com/guiltydog1'}, {'_type': 'snscrape.modules.twitter.User', 'username': 'EndGameWW3', 'id': 32792712, 'displayname': 'EndGameWW3 🇺🇸', 'description': None, 'rawDescription': None, 'descriptionUrls': None, 'verified': None, 'created': None, 'followersCount': None, 'friendsCount': None, 'statusesCount': None, 'favouritesCount': None, 'listedCount': None, 'mediaCount': None, 'location': None, 'protected': None, 'linkUrl': None, 'linkTcourl': None, 'profileImageUrl': None, 'profileBannerUrl': None, 'label': None, 'url': 'https://twitter.com/EndGameWW3'}]",,,,
snscrape.modules.twitter.Tweet,https://twitter.com/rondem1/status/1459235969102667792,2021-11-12 19:05:40+00:00,"Russia is poised to invade Ukraine, and MotherTucker is saying we should side with Russia because 'they have more oil"". So, it's OK to violate international law if oil is involved?","Russia is poised to invade Ukraine, and MotherTucker is saying we should side with Russia because 'they have more oil"". So, it's OK to violate international law if oil is involved?",1459235969102667792,"{'_type': 'snscrape.modules.twitter.User', 'username': 'rondem1', 'id': 1173204386, 'displayname': 'Ron DeMattio', 'description': ""artist over 60 years, and environmentalist for over 50 years. Was there when 'smog alerts' became a thing."", 'rawDescription': ""artist over 60 years, and environmentalist for over 50 years. Was there when 'smog alerts' became a thing."", 'descriptionUrls': None, 'verified': False, 'created': '2013-02-12T22:03:14+00:00', 'followersCount': 138, 'friendsCount': 682, 'statusesCount': 7737, 'favouritesCount': 7790, 'listedCount': 0, 'mediaCount': 157, 'location': '', 'protected': False, 'linkUrl': None, 'linkTcourl': None, 'profileImageUrl': 'https://pbs.twimg.com/profile_images/1449114202610745346/zJTaSA0e_normal.jpg', 'profileBannerUrl': 'https://pbs.twimg.com/profile_banners/1173204386/1634330793', 'label': None, 'url': 'https://twitter.com/rondem1'}",0,0,0,0,1459235969102667792,en,"<a href=""https://mobile.twitter.com"" rel=""nofollow"">Twitter Web App</a>",https://mobile.twitter.com,Twitter Web App,,,,,,,,,,,,
snscrape.modules.twitter.Tweet,https://twitter.com/Badgerswimr/status/1459234950096556043,2021-11-12 19:01:38+00:00,Russia invading Ukraine any good for crude oil?  I know we will just sit back and watch,Russia invading Ukraine any good for crude oil?  I know we will just sit back and watch,1459234950096556043,"{'_type': 'snscrape.modules.twitter.User', 'username': 'Badgerswimr', 'id': 111119549, 'displayname': 'Brian Wilson', 'description': '25 year pit Trader in Soybean options at Cbot', 'rawDescription': '25 year pit Trader in Soybean options at Cbot', 'descriptionUrls': None, 'verified': False, 'created': '2010-02-03T21:43:58+00:00', 'followersCount': 5360, 'friendsCount': 411, 'statusesCount': 18425, 'favouritesCount': 19386, 'listedCount': 100, 'mediaCount': 309, 'location': 'Chicago, IL', 'protected': False, 'linkUrl': None, 'linkTcourl': None, 'profileImageUrl': 'https://pbs.twimg.com/profile_images/1183841240216981505/h5ay9qMY_normal.jpg', 'profileBannerUrl': 'https://pbs.twimg.com/profile_banners/111119549/1571084723', 'label': None, 'url': 'https://twitter.com/Badgerswimr'}",4,0,6,0,1459234950096556043,en,"<a href=""http://twitter.com/download/iphone"" rel=""nofollow"">Twitter for iPhone</a>",http://twitter.com/download/iphone,Twitter for iPhone,,,,,,,,,,,,
snscrape.modules.twitter.Tweet,https://twitter.com/ClareConvert/status/1459146089597177861,2021-11-12 13:08:32+00:00,The situation in Europe is very fraught. Oil &amp; Gas prices are high due to insufficient supply frm Russia. Belarus using refugees are weapons inflaming eastern European nationalism &amp; threatening to cut gas supply. Russia massing troops near Belarus &amp; Ukraine &amp; flying nuke bombers,The situation in Europe is very fraught. Oil &amp; Gas prices are high due to insufficient supply frm Russia. Belarus using refugees are weapons inflaming eastern European nationalism &amp; threatening to cut gas supply. Russia massing troops near Belarus &amp; Ukraine &amp; flying nuke bombers,1459146089597177861,"{'_type': 'snscrape.modules.twitter.User', 'username': 'ClareConvert', 'id': 963391242360016898, 'displayname': 'Yusuf Pender', 'description': 'Son of Éire 🇮🇪\n\nIT Professional | Studying BA Theology prioryinstitute.com\n\nSearch/read the Holy Quran in English with optional exegesis openquran.com', 'rawDescription': 'Son of Éire 🇮🇪\n\nIT Professional | Studying BA Theology https://t.co/bsKSFej2KS\n\nSearch/read the Holy Quran in English with optional exegesis https://t.co/XwnUlwA2V7', 'descriptionUrls': [{'text': 'prioryinstitute.com', 'url': 'http://prioryinstitute.com', 'tcourl': 'https://t.co/bsKSFej2KS', 'indices': [55, 78]}, {'text': 'openquran.com', 'url': 'http://openquran.com', 'tcourl': 'https://t.co/XwnUlwA2V7', 'indices': [141, 164]}], 'verified': False, 'created': '2018-02-13T12:35:45+00:00', 'followersCount': 1094, 'friendsCount': 603, 'statusesCount': 3694, 'favouritesCount': 24781, 'listedCount': 2, 'mediaCount': 499, 'location': 'Ireland', 'protected': False, 'linkUrl': 'https://www.alislam.org/messiah', 'linkTcourl': 'https://t.co/H4HDGjdfun', 'profileImageUrl': 'https://pbs.twimg.com/profile_images/1501234138094964739/dm12dNSU_normal.jpg', 'profileBannerUrl': 'https://pbs.twimg.com/profile_banners/963391242360016898/1628105256', 'label': None, 'url': 'https://twitter.com/ClareConvert'}",1,3,5,0,1459146089597177861,en,"<a href=""https://mobile.twitter.com"" rel=""nofollow"">Twitter Web App</a>",https://mobile.twitter.com,Twitter Web App,,,,,,,,,,,,
snscrape.modules.twitter.Tweet,https://twitter.com/moyensdebord/status/1459124115126763520,2021-11-12 11:41:12+00:00,"@BH_Friedman For the life of me, I can think of no motive for Russia – a country with basically one source of income (oil) &amp; a ramshackle military – invading Ukraine, or anywhere else.
Stir up trouble in Ukraine's ethnic-Russian east because it feels threatened by NATO, yes. But that's it.","@BH_Friedman For the life of me, I can think of no motive for Russia – a country with basically one source of income (oil) &amp; a ramshackle military – invading Ukraine, or anywhere else.
Stir up trouble in Ukraine's ethnic-Russian east because it feels threatened by NATO, yes. But that's it.",1459124115126763520,"{'_type': 'snscrape.modules.twitter.User', 'username': 'moyensdebord', 'id': 1113739138925305863, 'displayname': 'Rod Miller', 'description': 'Translator, aerogeek, contrarian lefty, tree-hugger, animal-lover, part-time curmudgeon.\nflickr.com/photos/1461119…', 'rawDescription': 'Translator, aerogeek, contrarian lefty, tree-hugger, animal-lover, part-time curmudgeon.\nhttps://t.co/PHKSRrzR3U', 'descriptionUrls': [{'text': 'flickr.com/photos/1461119…', 'url': 'https://www.flickr.com/photos/146111925@N02/albums', 'tcourl': 'https://t.co/PHKSRrzR3U', 'indices': [89, 112]}], 'verified': False, 'created': '2019-04-04T09:44:37+00:00', 'followersCount': 123, 'friendsCount': 49, 'statusesCount': 20549, 'favouritesCount': 7476, 'listedCount': 6, 'mediaCount': 884, 'location': '', 'protected': False, 'linkUrl': None, 'linkTcourl': None, 'profileImageUrl': 'https://pbs.twimg.com/profile_images/1113739626894778368/hAyMwW0__normal.jpg', 'profileBannerUrl': 'https://pbs.twimg.com/profile_banners/1113739138925305863/1560125728', 'label': None, 'url': 'https://twitter.com/moyensdebord'}",0,0,1,0,1458883526523293698,en,"<a href=""https://mobile.twitter.com"" rel=""nofollow"">Twitter Web App</a>",https://mobile.twitter.com,Twitter Web App,,,,,,1.4588835265232937e+18,"{'_type': 'snscrape.modules.twitter.User', 'username': 'BH_Friedman', 'id': 831601609780113408, 'displayname': 'Ben Friedman', 'description': None, 'rawDescription': None, 'descriptionUrls': None, 'verified': None, 'created': None, 'followersCount': None, 'friendsCount': None, 'statusesCount': None, 'favouritesCount': None, 'listedCount': None, 'mediaCount': None, 'location': None, 'protected': None, 'linkUrl': None, 'linkTcourl': None, 'profileImageUrl': None, 'profileBannerUrl': None, 'label': None, 'url': 'https://twitter.com/BH_Friedman'}","[{'_type': 'snscrape.modules.twitter.User', 'username': 'BH_Friedman', 'id': 831601609780113408, 'displayname': 'Ben Friedman', 'description': None, 'rawDescription': None, 'descriptionUrls': None, 'verified': None, 'created': None, 'followersCount': None, 'friendsCount': None, 'statusesCount': None, 'favouritesCount': None, 'listedCount': None, 'mediaCount': None, 'location': None, 'protected': None, 'linkUrl': None, 'linkTcourl': None, 'profileImageUrl': None, 'profileBannerUrl': None, 'label': None, 'url': 'https://twitter.com/BH_Friedman'}]",,,,
snscrape.modules.twitter.Tweet,https://twitter.com/hilton_philip/status/1459081700093399041,2021-11-12 08:52:40+00:00,@BarrySheerman @BBCr4today Typical Russia flexing its might again just saw the news about Russia being at the boarder of #Ukraine in the @Telegraph news updates on #twitter any idea of what they are fighting over not oil is it? Russia certainly have some scary new Al drones from planes tanks even soldiers https://t.co/8LJ5fc7c4E,@BarrySheerman @BBCr4today Typical Russia flexing its might again just saw the news about Russia being at the boarder of #Ukraine in the @Telegraph news updates on #twitter any idea of what they are fighting over not oil is it? Russia certainly have some scary new Al drones from planes tanks even soldiers https://t.co/8LJ5fc7c4E,1459081700093399041,"{'_type': 'snscrape.modules.twitter.User', 'username': 'hilton_philip', 'id': 2778616972, 'displayname': 'Philip Hilton yogi main account', 'description': '#manager #socialmedia for #SassyVeZay #singer C/W #madonna #fan #artist fx #art #yogi writer #journalist manager #arnoldnelsontt Madonna girl Dale ,chef', 'rawDescription': '#manager #socialmedia for #SassyVeZay #singer C/W #madonna #fan #artist fx #art #yogi writer #journalist manager #arnoldnelsontt Madonna girl Dale ,chef', 'descriptionUrls': None, 'verified': False, 'created': '2014-09-21T05:08:32+00:00', 'followersCount': 3785, 'friendsCount': 4994, 'statusesCount': 80549, 'favouritesCount': 163303, 'listedCount': 139, 'mediaCount': 42808, 'location': 'eastleigh', 'protected': False, 'linkUrl': None, 'linkTcourl': None, 'profileImageUrl': 'https://pbs.twimg.com/profile_images/1503018460259004417/tn_FA9_R_normal.jpg', 'profileBannerUrl': 'https://pbs.twimg.com/profile_banners/2778616972/1647124360', 'label': None, 'url': 'https://twitter.com/hilton_philip'}",0,0,0,0,1459080141620101132,en,"<a href=""http://twitter.com/download/iphone"" rel=""nofollow"">Twitter for iPhone</a>",http://twitter.com/download/iphone,Twitter for iPhone,,,"[{'_type': 'snscrape.modules.twitter.Video', 'thumbnailUrl': 'https://pbs.twimg.com/ext_tw_video_thumb/1459081532841336840/pu/img/zsOiH75wa8RAC4YC.jpg', 'variants': [{'_type': 'snscrape.modules.twitter.VideoVariant', 'contentType': 'video/mp4', 'url': 'https://video.twimg.com/ext_tw_video/1459081532841336840/pu/vid/540x360/9O-k8rGYOOJEqChs.mp4?tag=12', 'bitrate': 832000}, {'_type': 'snscrape.modules.twitter.VideoVariant', 'contentType': 'video/mp4', 'url': 'https://video.twimg.com/ext_tw_video/1459081532841336840/pu/vid/404x270/Kw6zNA1iqbIhY3B3.mp4?tag=12', 'bitrate': 256000}, {'_type': 'snscrape.modules.twitter.VideoVariant', 'contentType': 'video/mp4', 'url': 'https://video.twimg.com/ext_tw_video/1459081532841336840/pu/vid/720x480/MVlwfemj4Bmqi3JA.mp4?tag=12', 'bitrate': 2176000}, {'_type': 'snscrape.modules.twitter.VideoVariant', 'contentType': 'application/x-mpegURL', 'url': 'https://video.twimg.com/ext_tw_video/1459081532841336840/pu/pl/Hq9SKKIUoILohLKs.m3u8?tag=12&container=fmp4', 'bitrate': None}], 'duration': 18.528, 'views': 77}]",,,1.459080141620101e+18,"{'_type': 'snscrape.modules.twitter.User', 'username': 'BarrySheerman', 'id': 250091875, 'displayname': 'Barry Sheerman MP', 'description': None, 'rawDescription': None, 'descriptionUrls': None, 'verified': None, 'created': None, 'followersCount': None, 'friendsCount': None, 'statusesCount': None, 'favouritesCount': None, 'listedCount': None, 'mediaCount': None, 'location': None, 'protected': None, 'linkUrl': None, 'linkTcourl': None, 'profileImageUrl': None, 'profileBannerUrl': None, 'label': None, 'url': 'https://twitter.com/BarrySheerman'}","[{'_type': 'snscrape.modules.twitter.User', 'username': 'BarrySheerman', 'id': 250091875, 'displayname': 'Barry Sheerman MP', 'description': None, 'rawDescription': None, 'descriptionUrls': None, 'verified': None, 'created': None, 'followersCount': None, 'friendsCount': None, 'statusesCount': None, 'favouritesCount': None, 'listedCount': None, 'mediaCount': None, 'location': None, 'protected': None, 'linkUrl': None, 'linkTcourl': None, 'profileImageUrl': None, 'profileBannerUrl': None, 'label': None, 'url': 'https://twitter.com/BarrySheerman'}, {'_type': 'snscrape.modules.twitter.User', 'username': 'BBCr4today', 'id': 8170292, 'displayname': 'BBC Radio 4 Today', 'description': None, 'rawDescription': None, 'descriptionUrls': None, 'verified': None, 'created': None, 'followersCount': None, 'friendsCount': None, 'statusesCount': None, 'favouritesCount': None, 'listedCount': None, 'mediaCount': None, 'location': None, 'protected': None, 'linkUrl': None, 'linkTcourl': None, 'profileImageUrl': None, 'profileBannerUrl': None, 'label': None, 'url': 'https://twitter.com/BBCr4today'}, {'_type': 'snscrape.modules.twitter.User', 'username': 'Telegraph', 'id': 16343974, 'displayname': 'The Telegraph', 'description': None, 'rawDescription': None, 'descriptionUrls': None, 'verified': None, 'created': None, 'followersCount': None, 'friendsCount': None, 'statusesCount': None, 'favouritesCount': None, 'listedCount': None, 'mediaCount': None, 'location': None, 'protected': None, 'linkUrl': None, 'linkTcourl': None, 'profileImageUrl': None, 'profileBannerUrl': None, 'label': None, 'url': 'https://twitter.com/Telegraph'}]",,,"['Ukraine', 'twitter']",
