_type,url,date,content,renderedContent,id,user,replyCount,retweetCount,likeCount,quoteCount,conversationId,lang,source,sourceUrl,sourceLabel,outlinks,tcooutlinks,media,retweetedTweet,quotedTweet,inReplyToTweetId,inReplyToUser,mentionedUsers,coordinates,place,hashtags,cashtags
snscrape.modules.twitter.Tweet,https://twitter.com/t_ballard_/status/1463294636760444931,2021-11-23 23:53:22+00:00,"@cspan Lol it’s you Biden ! you closed the oil pipeline’s, stop playing games with the America ppl…start telling the trust !!! Your nose is growing.     Now you want to send  military equipment and troops to Ukraine , we do not want to be in a War with Russia.","@cspan Lol it’s you Biden ! you closed the oil pipeline’s, stop playing games with the America ppl…start telling the trust !!! Your nose is growing.     Now you want to send  military equipment and troops to Ukraine , we do not want to be in a War with Russia.",1463294636760444931,"{'_type': 'snscrape.modules.twitter.User', 'username': 't_ballard_', 'id': 813507460539547648, 'displayname': 'Ballard', 'description': '🇺🇸 1st', 'rawDescription': '🇺🇸 1st', 'descriptionUrls': None, 'verified': False, 'created': '2016-12-26T22:11:07+00:00', 'followersCount': 3, 'friendsCount': 25, 'statusesCount': 456, 'favouritesCount': 556, 'listedCount': 0, 'mediaCount': 0, 'location': 'Florida, USA 🇺🇸', 'protected': False, 'linkUrl': None, 'linkTcourl': None, 'profileImageUrl': 'https://pbs.twimg.com/profile_images/1145018433878315008/3Me7al4T_normal.jpg', 'profileBannerUrl': 'https://pbs.twimg.com/profile_banners/813507460539547648/1562785308', 'label': None, 'url': 'https://twitter.com/t_ballard_'}",0,0,0,0,1463236704383520773,en,"<a href=""http://twitter.com/#!/download/ipad"" rel=""nofollow"">Twitter for iPad</a>",http://twitter.com/#!/download/ipad,Twitter for iPad,,,,,,1.4632367043835208e+18,"{'_type': 'snscrape.modules.twitter.User', 'username': 'cspan', 'id': 15675138, 'displayname': 'CSPAN', 'description': None, 'rawDescription': None, 'descriptionUrls': None, 'verified': None, 'created': None, 'followersCount': None, 'friendsCount': None, 'statusesCount': None, 'favouritesCount': None, 'listedCount': None, 'mediaCount': None, 'location': None, 'protected': None, 'linkUrl': None, 'linkTcourl': None, 'profileImageUrl': None, 'profileBannerUrl': None, 'label': None, 'url': 'https://twitter.com/cspan'}","[{'_type': 'snscrape.modules.twitter.User', 'username': 'cspan', 'id': 15675138, 'displayname': 'CSPAN', 'description': None, 'rawDescription': None, 'descriptionUrls': None, 'verified': None, 'created': None, 'followersCount': None, 'friendsCount': None, 'statusesCount': None, 'favouritesCount': None, 'listedCount': None, 'mediaCount': None, 'location': None, 'protected': None, 'linkUrl': None, 'linkTcourl': None, 'profileImageUrl': None, 'profileBannerUrl': None, 'label': None, 'url': 'https://twitter.com/cspan'}]",,,,
snscrape.modules.twitter.Tweet,https://twitter.com/LarryDu96606711/status/1463293654496428032,2021-11-23 23:49:28+00:00,Russia is gonna invade the Ukraine  and China is  gonna seize Taiwan as their territory and the US  is not gonna do a damn thing about it. It's  all gonna happen within a year to year and a half and all the while Joe's  selling our natural gas and oil to China.,Russia is gonna invade the Ukraine  and China is  gonna seize Taiwan as their territory and the US  is not gonna do a damn thing about it. It's  all gonna happen within a year to year and a half and all the while Joe's  selling our natural gas and oil to China.,1463293654496428032,"{'_type': 'snscrape.modules.twitter.User', 'username': 'LarryDu96606711', 'id': 1419050009853632517, 'displayname': 'mclar', 'description': 'Moderate conservative Constitutionalist', 'rawDescription': 'Moderate conservative Constitutionalist', 'descriptionUrls': None, 'verified': False, 'created': '2021-07-24T21:43:04+00:00', 'followersCount': 805, 'friendsCount': 1309, 'statusesCount': 2156, 'favouritesCount': 1618, 'listedCount': 0, 'mediaCount': 2, 'location': '', 'protected': False, 'linkUrl': None, 'linkTcourl': None, 'profileImageUrl': 'https://pbs.twimg.com/profile_images/1498350270300012546/DgxiTzpJ_normal.jpg', 'profileBannerUrl': None, 'label': None, 'url': 'https://twitter.com/LarryDu96606711'}",1,0,0,0,1463293654496428032,en,"<a href=""http://twitter.com/download/android"" rel=""nofollow"">Twitter for Android</a>",http://twitter.com/download/android,Twitter for Android,,,,,,,,,,,,
snscrape.modules.twitter.Tweet,https://twitter.com/mccrady_e/status/1463287775394996227,2021-11-23 23:26:06+00:00,Shark News-Opinion: One of these guys honeymooned in Russia.....The other one..closed down our KEYSTONE XL PIPELINE....then approved Russia Oil pipeline to to Ukraine and The his son arranged purchase of COBALT  MINE FOR CHINA PURCHASE COLLUSION”? COLLUSION/PAY FOR PLAY? https://t.co/kfbFUIiCsT,Shark News-Opinion: One of these guys honeymooned in Russia.....The other one..closed down our KEYSTONE XL PIPELINE....then approved Russia Oil pipeline to to Ukraine and The his son arranged purchase of COBALT  MINE FOR CHINA PURCHASE COLLUSION”? COLLUSION/PAY FOR PLAY? https://t.co/kfbFUIiCsT,1463287775394996227,"{'_type': 'snscrape.modules.twitter.User', 'username': 'mccrady_e', 'id': 800036483893723136, 'displayname': 'Bruce E. McCrady(Shark News)', 'description': 'Retired from McCarran Airport Airport Las Vegas Nevada.. living in Tampa Florida area..! US NAVY Vietnam era veteran', 'rawDescription': 'Retired from McCarran Airport Airport Las Vegas Nevada.. living in Tampa Florida area..! US NAVY Vietnam era veteran', 'descriptionUrls': None, 'verified': False, 'created': '2016-11-19T18:02:16+00:00', 'followersCount': 15445, 'friendsCount': 15268, 'statusesCount': 23961, 'favouritesCount': 8376, 'listedCount': 15, 'mediaCount': 4456, 'location': 'Tampa, FL', 'protected': False, 'linkUrl': None, 'linkTcourl': None, 'profileImageUrl': 'https://pbs.twimg.com/profile_images/803324945447133184/ZhaGaSrh_normal.jpg', 'profileBannerUrl': 'https://pbs.twimg.com/profile_banners/800036483893723136/1508036683', 'label': None, 'url': 'https://twitter.com/mccrady_e'}",2,0,2,1,1463287775394996227,en,"<a href=""http://twitter.com/#!/download/ipad"" rel=""nofollow"">Twitter for iPad</a>",http://twitter.com/#!/download/ipad,Twitter for iPad,,,"[{'_type': 'snscrape.modules.twitter.Photo', 'previewUrl': 'https://pbs.twimg.com/media/FE6ked5XEAIq-1m?format=jpg&name=small', 'fullUrl': 'https://pbs.twimg.com/media/FE6ked5XEAIq-1m?format=jpg&name=large'}]",,,,,,,,,
snscrape.modules.twitter.Tweet,https://twitter.com/chris__medland/status/1463279153956986880,2021-11-23 22:51:51+00:00,"@TomTugendhat @Tobias_Ellwood @JohnnyMercerUK it’s 2022, China invade Taiwan, Russian invade Ukraine, there are skirmishes on the Polish border. Oil prices are high, gas even higher, Russia shuts off supplies. Who do we have in charge to keep the UK functioning &amp; safe? #PepperPig","@TomTugendhat @Tobias_Ellwood @JohnnyMercerUK it’s 2022, China invade Taiwan, Russian invade Ukraine, there are skirmishes on the Polish border. Oil prices are high, gas even higher, Russia shuts off supplies. Who do we have in charge to keep the UK functioning &amp; safe? #PepperPig",1463279153956986880,"{'_type': 'snscrape.modules.twitter.User', 'username': 'chris__medland', 'id': 1425824153500733440, 'displayname': 'Chris Medland', 'description': 'Architect, RIBA , ARB, Director @OWD_architects. Post Grad Researcher/PhD student- housing Infrastructure resilience/Sustainability. @CES_Surrey @UniOfSurrey', 'rawDescription': 'Architect, RIBA , ARB, Director @OWD_architects. Post Grad Researcher/PhD student- housing Infrastructure resilience/Sustainability. @CES_Surrey @UniOfSurrey', 'descriptionUrls': None, 'verified': False, 'created': '2021-08-12T14:19:20+00:00', 'followersCount': 254, 'friendsCount': 1008, 'statusesCount': 4377, 'favouritesCount': 6100, 'listedCount': 0, 'mediaCount': 69, 'location': '', 'protected': False, 'linkUrl': None, 'linkTcourl': None, 'profileImageUrl': 'https://pbs.twimg.com/profile_images/1425824430354169870/M806LE2X_normal.jpg', 'profileBannerUrl': 'https://pbs.twimg.com/profile_banners/1425824153500733440/1633889210', 'label': None, 'url': 'https://twitter.com/chris__medland'}",0,0,0,0,1463279153956986880,en,"<a href=""http://twitter.com/download/iphone"" rel=""nofollow"">Twitter for iPhone</a>",http://twitter.com/download/iphone,Twitter for iPhone,,,,,,,,"[{'_type': 'snscrape.modules.twitter.User', 'username': 'TomTugendhat', 'id': 2173779986, 'displayname': 'Tom Tugendhat', 'description': None, 'rawDescription': None, 'descriptionUrls': None, 'verified': None, 'created': None, 'followersCount': None, 'friendsCount': None, 'statusesCount': None, 'favouritesCount': None, 'listedCount': None, 'mediaCount': None, 'location': None, 'protected': None, 'linkUrl': None, 'linkTcourl': None, 'profileImageUrl': None, 'profileBannerUrl': None, 'label': None, 'url': 'https://twitter.com/TomTugendhat'}, {'_type': 'snscrape.modules.twitter.User', 'username': 'Tobias_Ellwood', 'id': 482866177, 'displayname': 'Tobias Ellwood MP', 'description': None, 'rawDescription': None, 'descriptionUrls': None, 'verified': None, 'created': None, 'followersCount': None, 'friendsCount': None, 'statusesCount': None, 'favouritesCount': None, 'listedCount': None, 'mediaCount': None, 'location': None, 'protected': None, 'linkUrl': None, 'linkTcourl': None, 'profileImageUrl': None, 'profileBannerUrl': None, 'label': None, 'url': 'https://twitter.com/Tobias_Ellwood'}, {'_type': 'snscrape.modules.twitter.User', 'username': 'JohnnyMercerUK', 'id': 97402576, 'displayname': 'Johnny Mercer', 'description': None, 'rawDescription': None, 'descriptionUrls': None, 'verified': None, 'created': None, 'followersCount': None, 'friendsCount': None, 'statusesCount': None, 'favouritesCount': None, 'listedCount': None, 'mediaCount': None, 'location': None, 'protected': None, 'linkUrl': None, 'linkTcourl': None, 'profileImageUrl': None, 'profileBannerUrl': None, 'label': None, 'url': 'https://twitter.com/JohnnyMercerUK'}]","{'_type': 'snscrape.modules.twitter.Coordinates', 'longitude': -0.7577222, 'latitude': 51.073751}","{'_type': 'snscrape.modules.twitter.Place', 'fullName': 'Camelsdale, England', 'name': 'Camelsdale', 'type': 'city', 'country': 'United Kingdom', 'countryCode': 'GB'}",['PepperPig'],
snscrape.modules.twitter.Tweet,https://twitter.com/vipersnke/status/1463270548482449415,2021-11-23 22:17:39+00:00,"@chrisbergpov Look at the countries lowering strategic oil reserves.🤔
Maybe drawing down reserves is
part of a plan?
What if Russia invades Ukraine,
China tests Taiwan simultaneously?🤔 
ND should be ready to ramp up oil production, quickly!? #NDPol @theflagwzfg @SenKevinCramer @NDPetroleum","@chrisbergpov Look at the countries lowering strategic oil reserves.🤔
Maybe drawing down reserves is
part of a plan?
What if Russia invades Ukraine,
China tests Taiwan simultaneously?🤔 
ND should be ready to ramp up oil production, quickly!? #NDPol @theflagwzfg @SenKevinCramer @NDPetroleum",1463270548482449415,"{'_type': 'snscrape.modules.twitter.User', 'username': 'vipersnke', 'id': 21123733, 'displayname': 'White Mamba', 'description': 'Silence in the face of evil is evil itself.\nNot to speak is to speak.\nNot to act is to act. - Dietrich Bonhoeffer \n#TruthMatters #FactsMatter', 'rawDescription': 'Silence in the face of evil is evil itself.\nNot to speak is to speak.\nNot to act is to act. - Dietrich Bonhoeffer \n#TruthMatters #FactsMatter', 'descriptionUrls': None, 'verified': False, 'created': '2009-02-17T19:59:58+00:00', 'followersCount': 887, 'friendsCount': 3420, 'statusesCount': 32598, 'favouritesCount': 19107, 'listedCount': 5, 'mediaCount': 9196, 'location': 'United States', 'protected': False, 'linkUrl': None, 'linkTcourl': None, 'profileImageUrl': 'https://pbs.twimg.com/profile_images/1426508758658789379/8NZjNHg1_normal.jpg', 'profileBannerUrl': 'https://pbs.twimg.com/profile_banners/21123733/1606866123', 'label': None, 'url': 'https://twitter.com/vipersnke'}",1,0,0,0,1463266122409537536,en,"<a href=""http://twitter.com/download/android"" rel=""nofollow"">Twitter for Android</a>",http://twitter.com/download/android,Twitter for Android,,,,,,1.4632661224095375e+18,"{'_type': 'snscrape.modules.twitter.User', 'username': 'chrisbergpov', 'id': 33818820, 'displayname': 'Chris Berg', 'description': None, 'rawDescription': None, 'descriptionUrls': None, 'verified': None, 'created': None, 'followersCount': None, 'friendsCount': None, 'statusesCount': None, 'favouritesCount': None, 'listedCount': None, 'mediaCount': None, 'location': None, 'protected': None, 'linkUrl': None, 'linkTcourl': None, 'profileImageUrl': None, 'profileBannerUrl': None, 'label': None, 'url': 'https://twitter.com/chrisbergpov'}","[{'_type': 'snscrape.modules.twitter.User', 'username': 'chrisbergpov', 'id': 33818820, 'displayname': 'Chris Berg', 'description': None, 'rawDescription': None, 'descriptionUrls': None, 'verified': None, 'created': None, 'followersCount': None, 'friendsCount': None, 'statusesCount': None, 'favouritesCount': None, 'listedCount': None, 'mediaCount': None, 'location': None, 'protected': None, 'linkUrl': None, 'linkTcourl': None, 'profileImageUrl': None, 'profileBannerUrl': None, 'label': None, 'url': 'https://twitter.com/chrisbergpov'}, {'_type': 'snscrape.modules.twitter.User', 'username': 'theflagwzfg', 'id': 2550785948, 'displayname': 'AM 1100 The Flag WZFG', 'description': None, 'rawDescription': None, 'descriptionUrls': None, 'verified': None, 'created': None, 'followersCount': None, 'friendsCount': None, 'statusesCount': None, 'favouritesCount': None, 'listedCount': None, 'mediaCount': None, 'location': None, 'protected': None, 'linkUrl': None, 'linkTcourl': None, 'profileImageUrl': None, 'profileBannerUrl': None, 'label': None, 'url': 'https://twitter.com/theflagwzfg'}, {'_type': 'snscrape.modules.twitter.User', 'username': 'SenKevinCramer', 'id': 1048784496, 'displayname': 'Sen. Kevin Cramer', 'description': None, 'rawDescription': None, 'descriptionUrls': None, 'verified': None, 'created': None, 'followersCount': None, 'friendsCount': None, 'statusesCount': None, 'favouritesCount': None, 'listedCount': None, 'mediaCount': None, 'location': None, 'protected': None, 'linkUrl': None, 'linkTcourl': None, 'profileImageUrl': None, 'profileBannerUrl': None, 'label': None, 'url': 'https://twitter.com/SenKevinCramer'}, {'_type': 'snscrape.modules.twitter.User', 'username': 'NDPetroleum', 'id': 619059917, 'displayname': 'North Dakota Petroleum Council', 'description': None, 'rawDescription': None, 'descriptionUrls': None, 'verified': None, 'created': None, 'followersCount': None, 'friendsCount': None, 'statusesCount': None, 'favouritesCount': None, 'listedCount': None, 'mediaCount': None, 'location': None, 'protected': None, 'linkUrl': None, 'linkTcourl': None, 'profileImageUrl': None, 'profileBannerUrl': None, 'label': None, 'url': 'https://twitter.com/NDPetroleum'}]",,,['NDPol'],
