_type,url,date,content,renderedContent,id,user,replyCount,retweetCount,likeCount,quoteCount,conversationId,lang,source,sourceUrl,sourceLabel,outlinks,tcooutlinks,media,retweetedTweet,quotedTweet,inReplyToTweetId,inReplyToUser,mentionedUsers,coordinates,place,hashtags,cashtags
snscrape.modules.twitter.Tweet,https://twitter.com/DatFishe/status/1459463007159734273,2021-11-13 10:07:51+00:00,"@AliceTheLeftist @jregstuck Imo worst case scenario is that the USSR basically collapses, and becomes the German Vietnam/Afghanistan, but a trillion times worse. 

There's basically a 0% chance that they'd be able to hold ALL of Russia imo, but they could probably hold Ukraine and the Caucasian Oil Fields","@AliceTheLeftist @jregstuck Imo worst case scenario is that the USSR basically collapses, and becomes the German Vietnam/Afghanistan, but a trillion times worse. 

There's basically a 0% chance that they'd be able to hold ALL of Russia imo, but they could probably hold Ukraine and the Caucasian Oil Fields",1459463007159734273,"{'_type': 'snscrape.modules.twitter.User', 'username': 'DatFishe', 'id': 1197908802915295234, 'displayname': 'Dat Fishe', 'description': ""I am a fish. she/they/he. i'm also autistic, socialist, bi & have ADHD in case you care. gendered terms ok \n#actuallyautistic #blacklivesmatter 🏳️\u200d🌈🏳️\u200d⚧️"", 'rawDescription': ""I am a fish. she/they/he. i'm also autistic, socialist, bi & have ADHD in case you care. gendered terms ok \n#actuallyautistic #blacklivesmatter 🏳️\u200d🌈🏳️\u200d⚧️"", 'descriptionUrls': None, 'verified': False, 'created': '2019-11-22T16:04:59+00:00', 'followersCount': 1416, 'friendsCount': 2752, 'statusesCount': 39671, 'favouritesCount': 189873, 'listedCount': 7, 'mediaCount': 520, 'location': '', 'protected': False, 'linkUrl': None, 'linkTcourl': None, 'profileImageUrl': 'https://pbs.twimg.com/profile_images/1322970807358746624/UIxOipu1_normal.jpg', 'profileBannerUrl': 'https://pbs.twimg.com/profile_banners/1197908802915295234/1584662676', 'label': None, 'url': 'https://twitter.com/DatFishe'}",0,0,1,0,1459408432029593601,en,"<a href=""http://twitter.com/download/android"" rel=""nofollow"">Twitter for Android</a>",http://twitter.com/download/android,Twitter for Android,,,,,,1.459411742539223e+18,"{'_type': 'snscrape.modules.twitter.User', 'username': 'AliceTheLeftist', 'id': 1195551248906244097, 'displayname': 'Evergreen🏴\u200d☠️🏳️\u200d⚧️ average self-defense enjoyer', 'description': None, 'rawDescription': None, 'descriptionUrls': None, 'verified': None, 'created': None, 'followersCount': None, 'friendsCount': None, 'statusesCount': None, 'favouritesCount': None, 'listedCount': None, 'mediaCount': None, 'location': None, 'protected': None, 'linkUrl': None, 'linkTcourl': None, 'profileImageUrl': None, 'profileBannerUrl': None, 'label': None, 'url': 'https://twitter.com/AliceTheLeftist'}","[{'_type': 'snscrape.modules.twitter.User', 'username': 'AliceTheLeftist', 'id': 1195551248906244097, 'displayname': 'Evergreen🏴\u200d☠️🏳️\u200d⚧️ average self-defense enjoyer', 'description': None, 'rawDescription': None, 'descriptionUrls': None, 'verified': None, 'created': None, 'followersCount': None, 'friendsCount': None, 'statusesCount': None, 'favouritesCount': None, 'listedCount': None, 'mediaCount': None, 'location': None, 'protected': None, 'linkUrl': None, 'linkTcourl': None, 'profileImageUrl': None, 'profileBannerUrl': None, 'label': None, 'url': 'https://twitter.com/AliceTheLeftist'}]",,,,
snscrape.modules.twitter.Tweet,https://twitter.com/Dickvangelder/status/1459456298379005959,2021-11-13 09:41:11+00:00,"What is going on in the minde of US people? ""Why would we take Ukraine’s side? Why wouldn't we take Russia’s side?""

#Tucker: Why Would We Take Ukraine’s Side and Not #Russia? Who’s Got the Oil?  @TuckerCarlson @RepMikeTurner https://t.co/MVTDW98ivV","What is going on in the minde of US people? ""Why would we take Ukraine’s side? Why wouldn't we take Russia’s side?""

#Tucker: Why Would We Take Ukraine’s Side and Not #Russia? Who’s Got the Oil?  @TuckerCarlson @RepMikeTurner grabien.com/story.php?id=3…",1459456298379005959,"{'_type': 'snscrape.modules.twitter.User', 'username': 'Dickvangelder', 'id': 14613535, 'displayname': 'Dick Van Gelder 🦉🎼⚖️', 'description': 'My devotion is getting an intellectual property use case on the BlockChain, and creating a new economic business model. Views are my own.', 'rawDescription': 'My devotion is getting an intellectual property use case on the BlockChain, and creating a new economic business model. Views are my own.', 'descriptionUrls': None, 'verified': False, 'created': '2008-05-01T12:34:27+00:00', 'followersCount': 408, 'friendsCount': 1121, 'statusesCount': 18332, 'favouritesCount': 8619, 'listedCount': 31, 'mediaCount': 705, 'location': 'Belgium', 'protected': False, 'linkUrl': 'http://about.me/dickvangelder', 'linkTcourl': 'https://t.co/zEjfgmrsj0', 'profileImageUrl': 'https://pbs.twimg.com/profile_images/715906662926778369/i3FrUZoa_normal.jpg', 'profileBannerUrl': 'https://pbs.twimg.com/profile_banners/14613535/1505479241', 'label': None, 'url': 'https://twitter.com/Dickvangelder'}",0,0,0,0,1459456298379005959,en,"<a href=""https://mobile.twitter.com"" rel=""nofollow"">Twitter Web App</a>",https://mobile.twitter.com,Twitter Web App,['https://grabien.com/story.php?id=356915?utm_source=cliplist&utm_medium=email&utm_campaign=cliplist20211111&utm_content=story356915'],['https://t.co/MVTDW98ivV'],,,,,,"[{'_type': 'snscrape.modules.twitter.User', 'username': 'TuckerCarlson', 'id': 22703645, 'displayname': 'Tucker Carlson', 'description': None, 'rawDescription': None, 'descriptionUrls': None, 'verified': None, 'created': None, 'followersCount': None, 'friendsCount': None, 'statusesCount': None, 'favouritesCount': None, 'listedCount': None, 'mediaCount': None, 'location': None, 'protected': None, 'linkUrl': None, 'linkTcourl': None, 'profileImageUrl': None, 'profileBannerUrl': None, 'label': None, 'url': 'https://twitter.com/TuckerCarlson'}, {'_type': 'snscrape.modules.twitter.User', 'username': 'RepMikeTurner', 'id': 51228911, 'displayname': 'US Rep. Mike Turner', 'description': None, 'rawDescription': None, 'descriptionUrls': None, 'verified': None, 'created': None, 'followersCount': None, 'friendsCount': None, 'statusesCount': None, 'favouritesCount': None, 'listedCount': None, 'mediaCount': None, 'location': None, 'protected': None, 'linkUrl': None, 'linkTcourl': None, 'profileImageUrl': None, 'profileBannerUrl': None, 'label': None, 'url': 'https://twitter.com/RepMikeTurner'}]",,,"['Tucker', 'Russia']",
