_type,url,date,content,renderedContent,id,user,replyCount,retweetCount,likeCount,quoteCount,conversationId,lang,source,sourceUrl,sourceLabel,outlinks,tcooutlinks,media,retweetedTweet,quotedTweet,inReplyToTweetId,inReplyToUser,mentionedUsers,coordinates,place,hashtags,cashtags
snscrape.modules.twitter.Tweet,https://twitter.com/owhy3/status/1472335494478729217,2021-12-18 22:38:31+00:00,"@TheRealStranded @OilandEnergy There is an article at https://t.co/L97jhBbbby mentioning the future of Russia oil supply , seems to be that Putin is very well aware of a situation where the scenarios of possible Ukraine war is also considered whatsoever","@TheRealStranded @OilandEnergy There is an article at oilprice.com mentioning the future of Russia oil supply , seems to be that Putin is very well aware of a situation where the scenarios of possible Ukraine war is also considered whatsoever",1472335494478729217,"{'_type': 'snscrape.modules.twitter.User', 'username': 'owhy3', 'id': 2269557301, 'displayname': 'owhy3', 'description': '\' The Light shines in the darkness, and the darkness could not read the Light ..""\nJohn 1', 'rawDescription': '\' The Light shines in the darkness, and the darkness could not read the Light ..""\nJohn 1', 'descriptionUrls': None, 'verified': False, 'created': '2013-12-30T23:23:06+00:00', 'followersCount': 3239, 'friendsCount': 3170, 'statusesCount': 254507, 'favouritesCount': 11825, 'listedCount': 85, 'mediaCount': 12728, 'location': ' France 29y  -US 21y-  JPN 27y', 'protected': False, 'linkUrl': None, 'linkTcourl': None, 'profileImageUrl': 'https://pbs.twimg.com/profile_images/1237890326930395141/0dWA5lMY_normal.jpg', 'profileBannerUrl': 'https://pbs.twimg.com/profile_banners/2269557301/1596867424', 'label': None, 'url': 'https://twitter.com/owhy3'}",1,0,1,0,1472298427480678400,en,"<a href=""http://twitter.com/download/iphone"" rel=""nofollow"">Twitter for iPhone</a>",http://twitter.com/download/iphone,Twitter for iPhone,['http://oilprice.com'],['https://t.co/L97jhBbbby'],,,,1.4723332361981542e+18,"{'_type': 'snscrape.modules.twitter.User', 'username': 'TheRealStranded', 'id': 127114548, 'displayname': 'Stranded', 'description': None, 'rawDescription': None, 'descriptionUrls': None, 'verified': None, 'created': None, 'followersCount': None, 'friendsCount': None, 'statusesCount': None, 'favouritesCount': None, 'listedCount': None, 'mediaCount': None, 'location': None, 'protected': None, 'linkUrl': None, 'linkTcourl': None, 'profileImageUrl': None, 'profileBannerUrl': None, 'label': None, 'url': 'https://twitter.com/TheRealStranded'}","[{'_type': 'snscrape.modules.twitter.User', 'username': 'TheRealStranded', 'id': 127114548, 'displayname': 'Stranded', 'description': None, 'rawDescription': None, 'descriptionUrls': None, 'verified': None, 'created': None, 'followersCount': None, 'friendsCount': None, 'statusesCount': None, 'favouritesCount': None, 'listedCount': None, 'mediaCount': None, 'location': None, 'protected': None, 'linkUrl': None, 'linkTcourl': None, 'profileImageUrl': None, 'profileBannerUrl': None, 'label': None, 'url': 'https://twitter.com/TheRealStranded'}, {'_type': 'snscrape.modules.twitter.User', 'username': 'OilandEnergy', 'id': 87241834, 'displayname': 'OilPrice.com', 'description': None, 'rawDescription': None, 'descriptionUrls': None, 'verified': None, 'created': None, 'followersCount': None, 'friendsCount': None, 'statusesCount': None, 'favouritesCount': None, 'listedCount': None, 'mediaCount': None, 'location': None, 'protected': None, 'linkUrl': None, 'linkTcourl': None, 'profileImageUrl': None, 'profileBannerUrl': None, 'label': None, 'url': 'https://twitter.com/OilandEnergy'}]",,,,
snscrape.modules.twitter.Tweet,https://twitter.com/ColleenWinthrop/status/1472303825059000331,2021-12-18 20:32:40+00:00,"Well, in response to all the sanctions placed against it, NATO expansion, and the militarization of Eastern Europe (including the supply of very dangerous weapons to a puppet regime in Ukraine), Russia *will* ban the export of oil, gas, and metals to the US, UK, EU, and Japan. /4","Well, in response to all the sanctions placed against it, NATO expansion, and the militarization of Eastern Europe (including the supply of very dangerous weapons to a puppet regime in Ukraine), Russia *will* ban the export of oil, gas, and metals to the US, UK, EU, and Japan. /4",1472303825059000331,"{'_type': 'snscrape.modules.twitter.User', 'username': 'ColleenWinthrop', 'id': 1053928958, 'displayname': 'Colleen Winthrop', 'description': 'News and analysis - Russia, Eurasia, NATO, Ukraine, energy wars, Middle East, color revolutions, imperialism, new Cold War', 'rawDescription': 'News and analysis - Russia, Eurasia, NATO, Ukraine, energy wars, Middle East, color revolutions, imperialism, new Cold War', 'descriptionUrls': None, 'verified': False, 'created': '2013-01-02T01:40:08+00:00', 'followersCount': 399, 'friendsCount': 1830, 'statusesCount': 1257, 'favouritesCount': 222, 'listedCount': 1, 'mediaCount': 9, 'location': 'Long Island, NY', 'protected': False, 'linkUrl': 'https://colleenwinthrop.substack.com/', 'linkTcourl': 'https://t.co/95lfeja5GG', 'profileImageUrl': 'https://pbs.twimg.com/profile_images/478983696913948673/O16xrym4_normal.jpeg', 'profileBannerUrl': 'https://pbs.twimg.com/profile_banners/1053928958/1358522187', 'label': None, 'url': 'https://twitter.com/ColleenWinthrop'}",3,1,1,0,1472303819392434180,en,"<a href=""https://mobile.twitter.com"" rel=""nofollow"">Twitter Web App</a>",https://mobile.twitter.com,Twitter Web App,,,,,,1.4723038226892104e+18,"{'_type': 'snscrape.modules.twitter.User', 'username': 'ColleenWinthrop', 'id': 1053928958, 'displayname': 'Colleen Winthrop', 'description': 'News and analysis - Russia, Eurasia, NATO, Ukraine, energy wars, Middle East, color revolutions, imperialism, new Cold War', 'rawDescription': 'News and analysis - Russia, Eurasia, NATO, Ukraine, energy wars, Middle East, color revolutions, imperialism, new Cold War', 'descriptionUrls': None, 'verified': False, 'created': '2013-01-02T01:40:08+00:00', 'followersCount': 399, 'friendsCount': 1830, 'statusesCount': 1257, 'favouritesCount': 222, 'listedCount': 1, 'mediaCount': 9, 'location': 'Long Island, NY', 'protected': False, 'linkUrl': 'https://colleenwinthrop.substack.com/', 'linkTcourl': 'https://t.co/95lfeja5GG', 'profileImageUrl': 'https://pbs.twimg.com/profile_images/478983696913948673/O16xrym4_normal.jpeg', 'profileBannerUrl': 'https://pbs.twimg.com/profile_banners/1053928958/1358522187', 'label': None, 'url': 'https://twitter.com/ColleenWinthrop'}",,,,,
snscrape.modules.twitter.Tweet,https://twitter.com/heagney_william/status/1472301357621256203,2021-12-18 20:22:52+00:00,"@timkasbe Joe Biden and family are in bed w/China Russia Ukraine(quid pro quo) Hunter on board of oil company Libya they have been on the take for decades 
His brother caught stealing movies @ 49 from Blockbuster His Neice stolen credit cards racking up $100,000 NYC they should be in JAIL https://t.co/mCvJMA8hfA","@timkasbe Joe Biden and family are in bed w/China Russia Ukraine(quid pro quo) Hunter on board of oil company Libya they have been on the take for decades 
His brother caught stealing movies @ 49 from Blockbuster His Neice stolen credit cards racking up $100,000 NYC they should be in JAIL https://t.co/mCvJMA8hfA",1472301357621256203,"{'_type': 'snscrape.modules.twitter.User', 'username': 'heagney_william', 'id': 940280048665415680, 'displayname': 'WCH🇺🇸🦅🇺🇸 WCH', 'description': 'Lover of America 🇺🇸 son of a Marine\nNo DM’s', 'rawDescription': 'Lover of America 🇺🇸 son of a Marine\nNo DM’s', 'descriptionUrls': None, 'verified': False, 'created': '2017-12-11T18:00:07+00:00', 'followersCount': 566, 'friendsCount': 1099, 'statusesCount': 10277, 'favouritesCount': 12755, 'listedCount': 0, 'mediaCount': 1417, 'location': 'America ', 'protected': False, 'linkUrl': None, 'linkTcourl': None, 'profileImageUrl': 'https://pbs.twimg.com/profile_images/1323090379315548160/WrXQezgP_normal.jpg', 'profileBannerUrl': 'https://pbs.twimg.com/profile_banners/940280048665415680/1622820659', 'label': None, 'url': 'https://twitter.com/heagney_william'}",0,1,0,0,1472264973283848198,en,"<a href=""https://mobile.twitter.com"" rel=""nofollow"">Twitter Web App</a>",https://mobile.twitter.com,Twitter Web App,,,"[{'_type': 'snscrape.modules.twitter.Photo', 'previewUrl': 'https://pbs.twimg.com/media/FG6qR6PXIAAerbs?format=jpg&name=small', 'fullUrl': 'https://pbs.twimg.com/media/FG6qR6PXIAAerbs?format=jpg&name=large'}, {'_type': 'snscrape.modules.twitter.Photo', 'previewUrl': 'https://pbs.twimg.com/media/FG6qR6MWQA8f_qC?format=jpg&name=small', 'fullUrl': 'https://pbs.twimg.com/media/FG6qR6MWQA8f_qC?format=jpg&name=large'}, {'_type': 'snscrape.modules.twitter.Photo', 'previewUrl': 'https://pbs.twimg.com/media/FG6qR6MWQAcf6bC?format=jpg&name=small', 'fullUrl': 'https://pbs.twimg.com/media/FG6qR6MWQAcf6bC?format=jpg&name=large'}, {'_type': 'snscrape.modules.twitter.Photo', 'previewUrl': 'https://pbs.twimg.com/media/FG6qR6LXoAcOJUm?format=jpg&name=small', 'fullUrl': 'https://pbs.twimg.com/media/FG6qR6LXoAcOJUm?format=jpg&name=large'}]",,,1.4722649732838482e+18,"{'_type': 'snscrape.modules.twitter.User', 'username': 'timkasbe', 'id': 1417717635802828806, 'displayname': 'timkasbe', 'description': None, 'rawDescription': None, 'descriptionUrls': None, 'verified': None, 'created': None, 'followersCount': None, 'friendsCount': None, 'statusesCount': None, 'favouritesCount': None, 'listedCount': None, 'mediaCount': None, 'location': None, 'protected': None, 'linkUrl': None, 'linkTcourl': None, 'profileImageUrl': None, 'profileBannerUrl': None, 'label': None, 'url': 'https://twitter.com/timkasbe'}","[{'_type': 'snscrape.modules.twitter.User', 'username': 'timkasbe', 'id': 1417717635802828806, 'displayname': 'timkasbe', 'description': None, 'rawDescription': None, 'descriptionUrls': None, 'verified': None, 'created': None, 'followersCount': None, 'friendsCount': None, 'statusesCount': None, 'favouritesCount': None, 'listedCount': None, 'mediaCount': None, 'location': None, 'protected': None, 'linkUrl': None, 'linkTcourl': None, 'profileImageUrl': None, 'profileBannerUrl': None, 'label': None, 'url': 'https://twitter.com/timkasbe'}]",,,,
snscrape.modules.twitter.Tweet,https://twitter.com/ColleenWinthrop/status/1472285431584763906,2021-12-18 19:19:35+00:00,@Liveuamap The threat will be sanctions. No oil and gas sales to aggressor military blocs (NATO) and its puppet states (Ukraine). Russia can cope with no energy sales to the West. The West cannot cope without Russian energy. Finish.,@Liveuamap The threat will be sanctions. No oil and gas sales to aggressor military blocs (NATO) and its puppet states (Ukraine). Russia can cope with no energy sales to the West. The West cannot cope without Russian energy. Finish.,1472285431584763906,"{'_type': 'snscrape.modules.twitter.User', 'username': 'ColleenWinthrop', 'id': 1053928958, 'displayname': 'Colleen Winthrop', 'description': 'News and analysis - Russia, Eurasia, NATO, Ukraine, energy wars, Middle East, color revolutions, imperialism, new Cold War', 'rawDescription': 'News and analysis - Russia, Eurasia, NATO, Ukraine, energy wars, Middle East, color revolutions, imperialism, new Cold War', 'descriptionUrls': None, 'verified': False, 'created': '2013-01-02T01:40:08+00:00', 'followersCount': 399, 'friendsCount': 1830, 'statusesCount': 1257, 'favouritesCount': 222, 'listedCount': 1, 'mediaCount': 9, 'location': 'Long Island, NY', 'protected': False, 'linkUrl': 'https://colleenwinthrop.substack.com/', 'linkTcourl': 'https://t.co/95lfeja5GG', 'profileImageUrl': 'https://pbs.twimg.com/profile_images/478983696913948673/O16xrym4_normal.jpeg', 'profileBannerUrl': 'https://pbs.twimg.com/profile_banners/1053928958/1358522187', 'label': None, 'url': 'https://twitter.com/ColleenWinthrop'}",4,0,2,1,1472284276771201031,en,"<a href=""https://mobile.twitter.com"" rel=""nofollow"">Twitter Web App</a>",https://mobile.twitter.com,Twitter Web App,,,,,,1.472284276771201e+18,"{'_type': 'snscrape.modules.twitter.User', 'username': 'Liveuamap', 'id': 2388075212, 'displayname': 'Liveuamap', 'description': None, 'rawDescription': None, 'descriptionUrls': None, 'verified': None, 'created': None, 'followersCount': None, 'friendsCount': None, 'statusesCount': None, 'favouritesCount': None, 'listedCount': None, 'mediaCount': None, 'location': None, 'protected': None, 'linkUrl': None, 'linkTcourl': None, 'profileImageUrl': None, 'profileBannerUrl': None, 'label': None, 'url': 'https://twitter.com/Liveuamap'}","[{'_type': 'snscrape.modules.twitter.User', 'username': 'Liveuamap', 'id': 2388075212, 'displayname': 'Liveuamap', 'description': None, 'rawDescription': None, 'descriptionUrls': None, 'verified': None, 'created': None, 'followersCount': None, 'friendsCount': None, 'statusesCount': None, 'favouritesCount': None, 'listedCount': None, 'mediaCount': None, 'location': None, 'protected': None, 'linkUrl': None, 'linkTcourl': None, 'profileImageUrl': None, 'profileBannerUrl': None, 'label': None, 'url': 'https://twitter.com/Liveuamap'}]",,,,
snscrape.modules.twitter.Tweet,https://twitter.com/WALLSTREETWOLV3/status/1472271127531638797,2021-12-18 18:22:44+00:00,"@fbrody411 @perspective508 @HTDKtweets @DeskMina @BradDinardo @MoneySoot @SmokeyStock @SterlingStocks6 @Blvcksage @djunderh2o @DukeSilvaSax @Stock_Cube12 @jbridg9 @BigMasterDaddy I wish they were somehow selling it to the country of Ukraine. Naftogaz is owned by the state and apparently Russia is causing problems for Ukraine and the rest of Europe as far as oil and gas goes. 
https://t.co/ImLc533izd","@fbrody411 @perspective508 @HTDKtweets @DeskMina @BradDinardo @MoneySoot @SmokeyStock @SterlingStocks6 @Blvcksage @djunderh2o @DukeSilvaSax @Stock_Cube12 @jbridg9 @BigMasterDaddy I wish they were somehow selling it to the country of Ukraine. Naftogaz is owned by the state and apparently Russia is causing problems for Ukraine and the rest of Europe as far as oil and gas goes. 
kyivpost.com/ukraine-politi…",1472271127531638797,"{'_type': 'snscrape.modules.twitter.User', 'username': 'WALLSTREETWOLV3', 'id': 1393485411645853696, 'displayname': 'Jsketch101', 'description': ""There's no such thing as a coincidence.\nMy goal is to watch my money make money off the money my money makes. $GME"", 'rawDescription': ""There's no such thing as a coincidence.\nMy goal is to watch my money make money off the money my money makes. $GME"", 'descriptionUrls': None, 'verified': False, 'created': '2021-05-15T08:37:17+00:00', 'followersCount': 337, 'friendsCount': 463, 'statusesCount': 2855, 'favouritesCount': 1123, 'listedCount': 5, 'mediaCount': 782, 'location': 'NJ', 'protected': False, 'linkUrl': 'http://flawlessfinishings.com', 'linkTcourl': 'https://t.co/2FpmWJbnh5', 'profileImageUrl': 'https://pbs.twimg.com/profile_images/1454491524591407114/wkF3pDeN_normal.jpg', 'profileBannerUrl': 'https://pbs.twimg.com/profile_banners/1393485411645853696/1642869985', 'label': None, 'url': 'https://twitter.com/WALLSTREETWOLV3'}",1,0,5,0,1472035049490948100,en,"<a href=""https://mobile.twitter.com"" rel=""nofollow"">Twitter Web App</a>",https://mobile.twitter.com,Twitter Web App,['https://www.kyivpost.com/ukraine-politics/report-on-latest-naftogaz-mission-to-washington-and-the-nord-stream-2-issue.html'],['https://t.co/ImLc533izd'],,,,1.4721086961383055e+18,"{'_type': 'snscrape.modules.twitter.User', 'username': 'fbrody411', 'id': 105616885, 'displayname': 'Redd The Pirate', 'description': None, 'rawDescription': None, 'descriptionUrls': None, 'verified': None, 'created': None, 'followersCount': None, 'friendsCount': None, 'statusesCount': None, 'favouritesCount': None, 'listedCount': None, 'mediaCount': None, 'location': None, 'protected': None, 'linkUrl': None, 'linkTcourl': None, 'profileImageUrl': None, 'profileBannerUrl': None, 'label': None, 'url': 'https://twitter.com/fbrody411'}","[{'_type': 'snscrape.modules.twitter.User', 'username': 'fbrody411', 'id': 105616885, 'displayname': 'Redd The Pirate', 'description': None, 'rawDescription': None, 'descriptionUrls': None, 'verified': None, 'created': None, 'followersCount': None, 'friendsCount': None, 'statusesCount': None, 'favouritesCount': None, 'listedCount': None, 'mediaCount': None, 'location': None, 'protected': None, 'linkUrl': None, 'linkTcourl': None, 'profileImageUrl': None, 'profileBannerUrl': None, 'label': None, 'url': 'https://twitter.com/fbrody411'}, {'_type': 'snscrape.modules.twitter.User', 'username': 'perspective508', 'id': 1421878687360761856, 'displayname': 'Exact_Perspective508 ⭕️🦍🦋', 'description': None, 'rawDescription': None, 'descriptionUrls': None, 'verified': None, 'created': None, 'followersCount': None, 'friendsCount': None, 'statusesCount': None, 'favouritesCount': None, 'listedCount': None, 'mediaCount': None, 'location': None, 'protected': None, 'linkUrl': None, 'linkTcourl': None, 'profileImageUrl': None, 'profileBannerUrl': None, 'label': None, 'url': 'https://twitter.com/perspective508'}, {'_type': 'snscrape.modules.twitter.User', 'username': 'HTDKtweets', 'id': 1465160012611796995, 'displayname': 'HereToDropKnowledge', 'description': None, 'rawDescription': None, 'descriptionUrls': None, 'verified': None, 'created': None, 'followersCount': None, 'friendsCount': None, 'statusesCount': None, 'favouritesCount': None, 'listedCount': None, 'mediaCount': None, 'location': None, 'protected': None, 'linkUrl': None, 'linkTcourl': None, 'profileImageUrl': None, 'profileBannerUrl': None, 'label': None, 'url': 'https://twitter.com/HTDKtweets'}, {'_type': 'snscrape.modules.twitter.User', 'username': 'DeskMina', 'id': 1268648634742169608, 'displayname': 'Mina Desk', 'description': None, 'rawDescription': None, 'descriptionUrls': None, 'verified': None, 'created': None, 'followersCount': None, 'friendsCount': None, 'statusesCount': None, 'favouritesCount': None, 'listedCount': None, 'mediaCount': None, 'location': None, 'protected': None, 'linkUrl': None, 'linkTcourl': None, 'profileImageUrl': None, 'profileBannerUrl': None, 'label': None, 'url': 'https://twitter.com/DeskMina'}, {'_type': 'snscrape.modules.twitter.User', 'username': 'BradDinardo', 'id': 1198425064711938048, 'displayname': 'YouDownWithOPP', 'description': None, 'rawDescription': None, 'descriptionUrls': None, 'verified': None, 'created': None, 'followersCount': None, 'friendsCount': None, 'statusesCount': None, 'favouritesCount': None, 'listedCount': None, 'mediaCount': None, 'location': None, 'protected': None, 'linkUrl': None, 'linkTcourl': None, 'profileImageUrl': None, 'profileBannerUrl': None, 'label': None, 'url': 'https://twitter.com/BradDinardo'}, {'_type': 'snscrape.modules.twitter.User', 'username': 'MoneySoot', 'id': 1432430380209037317, 'displayname': 'Bird Lady Rollerpigeons', 'description': None, 'rawDescription': None, 'descriptionUrls': None, 'verified': None, 'created': None, 'followersCount': None, 'friendsCount': None, 'statusesCount': None, 'favouritesCount': None, 'listedCount': None, 'mediaCount': None, 'location': None, 'protected': None, 'linkUrl': None, 'linkTcourl': None, 'profileImageUrl': None, 'profileBannerUrl': None, 'label': None, 'url': 'https://twitter.com/MoneySoot'}, {'_type': 'snscrape.modules.twitter.User', 'username': 'SmokeyStock', 'id': 1417267676116815880, 'displayname': 'UncleSmokeyStockTrades', 'description': None, 'rawDescription': None, 'descriptionUrls': None, 'verified': None, 'created': None, 'followersCount': None, 'friendsCount': None, 'statusesCount': None, 'favouritesCount': None, 'listedCount': None, 'mediaCount': None, 'location': None, 'protected': None, 'linkUrl': None, 'linkTcourl': None, 'profileImageUrl': None, 'profileBannerUrl': None, 'label': None, 'url': 'https://twitter.com/SmokeyStock'}, {'_type': 'snscrape.modules.twitter.User', 'username': 'SterlingStocks6', 'id': 1370590279452012547, 'displayname': 'Sterling Stocks', 'description': None, 'rawDescription': None, 'descriptionUrls': None, 'verified': None, 'created': None, 'followersCount': None, 'friendsCount': None, 'statusesCount': None, 'favouritesCount': None, 'listedCount': None, 'mediaCount': None, 'location': None, 'protected': None, 'linkUrl': None, 'linkTcourl': None, 'profileImageUrl': None, 'profileBannerUrl': None, 'label': None, 'url': 'https://twitter.com/SterlingStocks6'}, {'_type': 'snscrape.modules.twitter.User', 'username': 'Blvcksage', 'id': 223195471, 'displayname': 'The Calculated Investor🥃', 'description': None, 'rawDescription': None, 'descriptionUrls': None, 'verified': None, 'created': None, 'followersCount': None, 'friendsCount': None, 'statusesCount': None, 'favouritesCount': None, 'listedCount': None, 'mediaCount': None, 'location': None, 'protected': None, 'linkUrl': None, 'linkTcourl': None, 'profileImageUrl': None, 'profileBannerUrl': None, 'label': None, 'url': 'https://twitter.com/Blvcksage'}, {'_type': 'snscrape.modules.twitter.User', 'username': 'djunderh2o', 'id': 784842446, 'displayname': 'dave', 'description': None, 'rawDescription': None, 'descriptionUrls': None, 'verified': None, 'created': None, 'followersCount': None, 'friendsCount': None, 'statusesCount': None, 'favouritesCount': None, 'listedCount': None, 'mediaCount': None, 'location': None, 'protected': None, 'linkUrl': None, 'linkTcourl': None, 'profileImageUrl': None, 'profileBannerUrl': None, 'label': None, 'url': 'https://twitter.com/djunderh2o'}, {'_type': 'snscrape.modules.twitter.User', 'username': 'DukeSilvaSax', 'id': 1408201018475749382, 'displayname': 'Duke Silver', 'description': None, 'rawDescription': None, 'descriptionUrls': None, 'verified': None, 'created': None, 'followersCount': None, 'friendsCount': None, 'statusesCount': None, 'favouritesCount': None, 'listedCount': None, 'mediaCount': None, 'location': None, 'protected': None, 'linkUrl': None, 'linkTcourl': None, 'profileImageUrl': None, 'profileBannerUrl': None, 'label': None, 'url': 'https://twitter.com/DukeSilvaSax'}, {'_type': 'snscrape.modules.twitter.User', 'username': 'Stock_Cube12', 'id': 1360662364178288648, 'displayname': '🇬🇧🦋🆂🆃🅾🅲🅺🅲🆄🅱🅴🦋🇬🇧', 'description': None, 'rawDescription': None, 'descriptionUrls': None, 'verified': None, 'created': None, 'followersCount': None, 'friendsCount': None, 'statusesCount': None, 'favouritesCount': None, 'listedCount': None, 'mediaCount': None, 'location': None, 'protected': None, 'linkUrl': None, 'linkTcourl': None, 'profileImageUrl': None, 'profileBannerUrl': None, 'label': None, 'url': 'https://twitter.com/Stock_Cube12'}, {'_type': 'snscrape.modules.twitter.User', 'username': 'jbridg9', 'id': 942132561710600192, 'displayname': 'Jbridg9', 'description': None, 'rawDescription': None, 'descriptionUrls': None, 'verified': None, 'created': None, 'followersCount': None, 'friendsCount': None, 'statusesCount': None, 'favouritesCount': None, 'listedCount': None, 'mediaCount': None, 'location': None, 'protected': None, 'linkUrl': None, 'linkTcourl': None, 'profileImageUrl': None, 'profileBannerUrl': None, 'label': None, 'url': 'https://twitter.com/jbridg9'}, {'_type': 'snscrape.modules.twitter.User', 'username': 'BigMasterDaddy', 'id': 1259846759808983041, 'displayname': 'Goblin King - #METASTRONG', 'description': None, 'rawDescription': None, 'descriptionUrls': None, 'verified': None, 'created': None, 'followersCount': None, 'friendsCount': None, 'statusesCount': None, 'favouritesCount': None, 'listedCount': None, 'mediaCount': None, 'location': None, 'protected': None, 'linkUrl': None, 'linkTcourl': None, 'profileImageUrl': None, 'profileBannerUrl': None, 'label': None, 'url': 'https://twitter.com/BigMasterDaddy'}]",,,,
