_type,url,date,content,renderedContent,id,user,replyCount,retweetCount,likeCount,quoteCount,conversationId,lang,source,sourceUrl,sourceLabel,outlinks,tcooutlinks,media,retweetedTweet,quotedTweet,inReplyToTweetId,inReplyToUser,mentionedUsers,coordinates,place,hashtags,cashtags
snscrape.modules.twitter.Tweet,https://twitter.com/cjenscook/status/1472270191476326407,2021-12-18 18:19:01+00:00,"@matt_h2o @AlekseyBu A new route with (I presume) state of the art compressor efficiency  &amp; as far as Russia is concerned, no Ukraine oligarch tax. So once operational more gas is free to market. Similarly, new &amp; more efficient oil refineries (in the right place) reduce global aggregate demand","@matt_h2o @AlekseyBu A new route with (I presume) state of the art compressor efficiency  &amp; as far as Russia is concerned, no Ukraine oligarch tax. So once operational more gas is free to market. Similarly, new &amp; more efficient oil refineries (in the right place) reduce global aggregate demand",1472270191476326407,"{'_type': 'snscrape.modules.twitter.User', 'username': 'cjenscook', 'id': 307653405, 'displayname': 'Chris Cook', 'description': 'Market 3.0 - where markets and Internet come together - in reality-based policy. For oil I look to #OOTT', 'rawDescription': 'Market 3.0 - where markets and Internet come together - in reality-based policy. For oil I look to #OOTT', 'descriptionUrls': None, 'verified': False, 'created': '2011-05-30T01:48:12+00:00', 'followersCount': 6126, 'friendsCount': 99, 'statusesCount': 47904, 'favouritesCount': 25111, 'listedCount': 222, 'mediaCount': 728, 'location': 'Linlithgow', 'protected': False, 'linkUrl': 'https://www.island-power.net/', 'linkTcourl': 'https://t.co/PYnQbUxVWn', 'profileImageUrl': 'https://pbs.twimg.com/profile_images/1784792411/mahla_darian__4__normal.JPG', 'profileBannerUrl': None, 'label': None, 'url': 'https://twitter.com/cjenscook'}",1,0,3,0,1472159276240097280,en,"<a href=""http://twitter.com/download/android"" rel=""nofollow"">Twitter for Android</a>",http://twitter.com/download/android,Twitter for Android,,,,,,1.4721592762400973e+18,"{'_type': 'snscrape.modules.twitter.User', 'username': 'matt_h2o', 'id': 248411828, 'displayname': 'Matt Drinkwater', 'description': None, 'rawDescription': None, 'descriptionUrls': None, 'verified': None, 'created': None, 'followersCount': None, 'friendsCount': None, 'statusesCount': None, 'favouritesCount': None, 'listedCount': None, 'mediaCount': None, 'location': None, 'protected': None, 'linkUrl': None, 'linkTcourl': None, 'profileImageUrl': None, 'profileBannerUrl': None, 'label': None, 'url': 'https://twitter.com/matt_h2o'}","[{'_type': 'snscrape.modules.twitter.User', 'username': 'matt_h2o', 'id': 248411828, 'displayname': 'Matt Drinkwater', 'description': None, 'rawDescription': None, 'descriptionUrls': None, 'verified': None, 'created': None, 'followersCount': None, 'friendsCount': None, 'statusesCount': None, 'favouritesCount': None, 'listedCount': None, 'mediaCount': None, 'location': None, 'protected': None, 'linkUrl': None, 'linkTcourl': None, 'profileImageUrl': None, 'profileBannerUrl': None, 'label': None, 'url': 'https://twitter.com/matt_h2o'}, {'_type': 'snscrape.modules.twitter.User', 'username': 'AlekseyBu', 'id': 393353461, 'displayname': 'Aleksey', 'description': None, 'rawDescription': None, 'descriptionUrls': None, 'verified': None, 'created': None, 'followersCount': None, 'friendsCount': None, 'statusesCount': None, 'favouritesCount': None, 'listedCount': None, 'mediaCount': None, 'location': None, 'protected': None, 'linkUrl': None, 'linkTcourl': None, 'profileImageUrl': None, 'profileBannerUrl': None, 'label': None, 'url': 'https://twitter.com/AlekseyBu'}]",,,,
snscrape.modules.twitter.Tweet,https://twitter.com/10FathomLine/status/1472260144541016067,2021-12-18 17:39:06+00:00,"@tedcruz This is a pipeline from Russia to Europe that Germany already said would be shut if Russia invades Ukraine. The US has no business telling allies what to do or force them to buy Texas oil.

Imagine Europe imposing sanctions on the the USA or Canada for cross border oil pipelines.","@tedcruz This is a pipeline from Russia to Europe that Germany already said would be shut if Russia invades Ukraine. The US has no business telling allies what to do or force them to buy Texas oil.

Imagine Europe imposing sanctions on the the USA or Canada for cross border oil pipelines.",1472260144541016067,"{'_type': 'snscrape.modules.twitter.User', 'username': '10FathomLine', 'id': 2379466214, 'displayname': 'salty seadude 🇺🇸Defend Democracy & Environment', 'description': 'To save our country and our environment, we need politicians who believe in democracy and in science - and not in conspiracies or in Trump. North to the Future!', 'rawDescription': 'To save our country and our environment, we need politicians who believe in democracy and in science - and not in conspiracies or in Trump. North to the Future!', 'descriptionUrls': None, 'verified': False, 'created': '2014-03-08T23:48:39+00:00', 'followersCount': 590, 'friendsCount': 905, 'statusesCount': 24944, 'favouritesCount': 25264, 'listedCount': 7, 'mediaCount': 1798, 'location': 'Alaska, USA', 'protected': False, 'linkUrl': None, 'linkTcourl': None, 'profileImageUrl': 'https://pbs.twimg.com/profile_images/1329549249961369601/LFnCpvIO_normal.jpg', 'profileBannerUrl': None, 'label': None, 'url': 'https://twitter.com/10FathomLine'}",5,3,45,1,1472251346879455239,en,"<a href=""http://twitter.com/#!/download/ipad"" rel=""nofollow"">Twitter for iPad</a>",http://twitter.com/#!/download/ipad,Twitter for iPad,,,,,,1.4722513468794552e+18,"{'_type': 'snscrape.modules.twitter.User', 'username': 'tedcruz', 'id': 23022687, 'displayname': 'Ted Cruz', 'description': None, 'rawDescription': None, 'descriptionUrls': None, 'verified': None, 'created': None, 'followersCount': None, 'friendsCount': None, 'statusesCount': None, 'favouritesCount': None, 'listedCount': None, 'mediaCount': None, 'location': None, 'protected': None, 'linkUrl': None, 'linkTcourl': None, 'profileImageUrl': None, 'profileBannerUrl': None, 'label': None, 'url': 'https://twitter.com/tedcruz'}","[{'_type': 'snscrape.modules.twitter.User', 'username': 'tedcruz', 'id': 23022687, 'displayname': 'Ted Cruz', 'description': None, 'rawDescription': None, 'descriptionUrls': None, 'verified': None, 'created': None, 'followersCount': None, 'friendsCount': None, 'statusesCount': None, 'favouritesCount': None, 'listedCount': None, 'mediaCount': None, 'location': None, 'protected': None, 'linkUrl': None, 'linkTcourl': None, 'profileImageUrl': None, 'profileBannerUrl': None, 'label': None, 'url': 'https://twitter.com/tedcruz'}]",,,,
snscrape.modules.twitter.Tweet,https://twitter.com/jason01912/status/1472234391925526530,2021-12-18 15:56:46+00:00,"UPDATE 6-Russia demands NATO roll back from East Europe and stay out of Ukraine https://t.co/Ppwz3Qoqwt via @Yahoo Russia, the “World Power” with economy smaller than tiny Italy needs to be put in its place by shutting down its crude oil based economy. Russia is like Saudi Arabia","UPDATE 6-Russia demands NATO roll back from East Europe and stay out of Ukraine yahoo.com/finance/news/1… via @Yahoo Russia, the “World Power” with economy smaller than tiny Italy needs to be put in its place by shutting down its crude oil based economy. Russia is like Saudi Arabia",1472234391925526530,"{'_type': 'snscrape.modules.twitter.User', 'username': 'jason01912', 'id': 1470088816887095296, 'displayname': 'Jason01912', 'description': '', 'rawDescription': '', 'descriptionUrls': None, 'verified': False, 'created': '2021-12-12T17:51:59+00:00', 'followersCount': 2, 'friendsCount': 2, 'statusesCount': 1357, 'favouritesCount': 1, 'listedCount': 0, 'mediaCount': 1, 'location': '', 'protected': False, 'linkUrl': None, 'linkTcourl': None, 'profileImageUrl': 'https://abs.twimg.com/sticky/default_profile_images/default_profile_normal.png', 'profileBannerUrl': None, 'label': None, 'url': 'https://twitter.com/jason01912'}",0,0,0,0,1472234391925526530,en,"<a href=""https://mobile.twitter.com"" rel=""nofollow"">Twitter Web App</a>",https://mobile.twitter.com,Twitter Web App,['https://www.yahoo.com/finance/news/1-russia-says-western-response-112140889.html?soc_src=social-sh&soc_trk=tw&tsrc=twtr'],['https://t.co/Ppwz3Qoqwt'],,,,,,"[{'_type': 'snscrape.modules.twitter.User', 'username': 'Yahoo', 'id': 19380829, 'displayname': 'Yahoo', 'description': None, 'rawDescription': None, 'descriptionUrls': None, 'verified': None, 'created': None, 'followersCount': None, 'friendsCount': None, 'statusesCount': None, 'favouritesCount': None, 'listedCount': None, 'mediaCount': None, 'location': None, 'protected': None, 'linkUrl': None, 'linkTcourl': None, 'profileImageUrl': None, 'profileBannerUrl': None, 'label': None, 'url': 'https://twitter.com/Yahoo'}]",,,,
snscrape.modules.twitter.Tweet,https://twitter.com/S1mplycu2/status/1472226026658930691,2021-12-18 15:23:32+00:00,"@TeeterA5 @OccupyDemocrats Rick Perry appears to be a sleazy, oily politician with no sense of right and wrong.  This is in response to the sweet deal on oil he got from Russia.  What is the Russian connection of the T…p group?  Did they hold aid from Ukraine to benefit Russia at Putin’s request? Fishy!","@TeeterA5 @OccupyDemocrats Rick Perry appears to be a sleazy, oily politician with no sense of right and wrong.  This is in response to the sweet deal on oil he got from Russia.  What is the Russian connection of the T…p group?  Did they hold aid from Ukraine to benefit Russia at Putin’s request? Fishy!",1472226026658930691,"{'_type': 'snscrape.modules.twitter.User', 'username': 'S1mplycu2', 'id': 984452488613937153, 'displayname': 'Edith curtis', 'description': '', 'rawDescription': '', 'descriptionUrls': None, 'verified': False, 'created': '2018-04-12T15:25:38+00:00', 'followersCount': 7, 'friendsCount': 170, 'statusesCount': 1416, 'favouritesCount': 962, 'listedCount': 1, 'mediaCount': 0, 'location': '', 'protected': False, 'linkUrl': None, 'linkTcourl': None, 'profileImageUrl': 'https://abs.twimg.com/sticky/default_profile_images/default_profile_normal.png', 'profileBannerUrl': None, 'label': None, 'url': 'https://twitter.com/S1mplycu2'}",0,2,4,0,1471987143576891394,en,"<a href=""http://twitter.com/#!/download/ipad"" rel=""nofollow"">Twitter for iPad</a>",http://twitter.com/#!/download/ipad,Twitter for iPad,,,,,,1.4721730011226153e+18,"{'_type': 'snscrape.modules.twitter.User', 'username': 'TeeterA5', 'id': 1348669393820069889, 'displayname': 'Adrienne 🌻🌻#IStandWithUkraine🌻🌻', 'description': None, 'rawDescription': None, 'descriptionUrls': None, 'verified': None, 'created': None, 'followersCount': None, 'friendsCount': None, 'statusesCount': None, 'favouritesCount': None, 'listedCount': None, 'mediaCount': None, 'location': None, 'protected': None, 'linkUrl': None, 'linkTcourl': None, 'profileImageUrl': None, 'profileBannerUrl': None, 'label': None, 'url': 'https://twitter.com/TeeterA5'}","[{'_type': 'snscrape.modules.twitter.User', 'username': 'TeeterA5', 'id': 1348669393820069889, 'displayname': 'Adrienne 🌻🌻#IStandWithUkraine🌻🌻', 'description': None, 'rawDescription': None, 'descriptionUrls': None, 'verified': None, 'created': None, 'followersCount': None, 'friendsCount': None, 'statusesCount': None, 'favouritesCount': None, 'listedCount': None, 'mediaCount': None, 'location': None, 'protected': None, 'linkUrl': None, 'linkTcourl': None, 'profileImageUrl': None, 'profileBannerUrl': None, 'label': None, 'url': 'https://twitter.com/TeeterA5'}, {'_type': 'snscrape.modules.twitter.User', 'username': 'OccupyDemocrats', 'id': 878284831, 'displayname': 'Occupy Democrats', 'description': None, 'rawDescription': None, 'descriptionUrls': None, 'verified': None, 'created': None, 'followersCount': None, 'friendsCount': None, 'statusesCount': None, 'favouritesCount': None, 'listedCount': None, 'mediaCount': None, 'location': None, 'protected': None, 'linkUrl': None, 'linkTcourl': None, 'profileImageUrl': None, 'profileBannerUrl': None, 'label': None, 'url': 'https://twitter.com/OccupyDemocrats'}]",,,,
snscrape.modules.twitter.Tweet,https://twitter.com/ken_ragsdale/status/1472199810816036865,2021-12-18 13:39:21+00:00,U.S. oil prices rise to 3-week high as U.S. crude supplies decline and Russia-Ukraine tensions climb @DougCarel  https://t.co/8D9OJlwmmG,U.S. oil prices rise to 3-week high as U.S. crude supplies decline and Russia-Ukraine tensions climb @DougCarel  marketwatch.com/story/oil-pric…,1472199810816036865,"{'_type': 'snscrape.modules.twitter.User', 'username': 'ken_ragsdale', 'id': 2539908208, 'displayname': 'Ken Ragsdale', 'description': 'Business broker in the Oklahoma City metro area for more than three decades.  Husband.  Father of two.', 'rawDescription': 'Business broker in the Oklahoma City metro area for more than three decades.  Husband.  Father of two.', 'descriptionUrls': None, 'verified': False, 'created': '2014-05-10T23:07:10+00:00', 'followersCount': 3900, 'friendsCount': 4347, 'statusesCount': 450809, 'favouritesCount': 115452, 'listedCount': 1604, 'mediaCount': 4443, 'location': 'Oklahoma City, OK', 'protected': False, 'linkUrl': 'http://broker.bizbuysell.com/ragsdalebiz', 'linkTcourl': 'http://t.co/6rKb7mB8yT', 'profileImageUrl': 'https://pbs.twimg.com/profile_images/500023419530797057/PBIFmGfg_normal.jpeg', 'profileBannerUrl': 'https://pbs.twimg.com/profile_banners/2539908208/1416678700', 'label': None, 'url': 'https://twitter.com/ken_ragsdale'}",0,0,1,0,1472199810816036865,en,"<a href=""https://mobile.twitter.com"" rel=""nofollow"">Twitter Web App</a>",https://mobile.twitter.com,Twitter Web App,['https://www.marketwatch.com/story/oil-prices-rise-as-traders-look-past-omicron-worries-11639658357?reflink=mw_share_twitter'],['https://t.co/8D9OJlwmmG'],,,,,,"[{'_type': 'snscrape.modules.twitter.User', 'username': 'DougCarel', 'id': 1193737766, 'displayname': 'Doug Carel', 'description': None, 'rawDescription': None, 'descriptionUrls': None, 'verified': None, 'created': None, 'followersCount': None, 'friendsCount': None, 'statusesCount': None, 'favouritesCount': None, 'listedCount': None, 'mediaCount': None, 'location': None, 'protected': None, 'linkUrl': None, 'linkTcourl': None, 'profileImageUrl': None, 'profileBannerUrl': None, 'label': None, 'url': 'https://twitter.com/DougCarel'}]",,,,
snscrape.modules.twitter.Tweet,https://twitter.com/pammyjtmm55/status/1472187758877761542,2021-12-18 12:51:28+00:00,@AvengerResister Didn't he make enough money off the trips to Ukraine and Russia and the gas and oil deals he made?,@AvengerResister Didn't he make enough money off the trips to Ukraine and Russia and the gas and oil deals he made?,1472187758877761542,"{'_type': 'snscrape.modules.twitter.User', 'username': 'pammyjtmm55', 'id': 3057783945, 'displayname': 'Pam', 'description': '', 'rawDescription': '', 'descriptionUrls': None, 'verified': False, 'created': '2015-02-24T01:45:38+00:00', 'followersCount': 119, 'friendsCount': 570, 'statusesCount': 16371, 'favouritesCount': 44453, 'listedCount': 0, 'mediaCount': 17, 'location': '', 'protected': False, 'linkUrl': None, 'linkTcourl': None, 'profileImageUrl': 'https://pbs.twimg.com/profile_images/1017945896514998272/am3kmOEm_normal.jpg', 'profileBannerUrl': None, 'label': None, 'url': 'https://twitter.com/pammyjtmm55'}",0,0,0,0,1471994550898024458,en,"<a href=""http://twitter.com/download/android"" rel=""nofollow"">Twitter for Android</a>",http://twitter.com/download/android,Twitter for Android,,,,,,1.4719945508980244e+18,"{'_type': 'snscrape.modules.twitter.User', 'username': 'AvengerResister', 'id': 1334688905929613312, 'displayname': 'Avenger Resister', 'description': None, 'rawDescription': None, 'descriptionUrls': None, 'verified': None, 'created': None, 'followersCount': None, 'friendsCount': None, 'statusesCount': None, 'favouritesCount': None, 'listedCount': None, 'mediaCount': None, 'location': None, 'protected': None, 'linkUrl': None, 'linkTcourl': None, 'profileImageUrl': None, 'profileBannerUrl': None, 'label': None, 'url': 'https://twitter.com/AvengerResister'}","[{'_type': 'snscrape.modules.twitter.User', 'username': 'AvengerResister', 'id': 1334688905929613312, 'displayname': 'Avenger Resister', 'description': None, 'rawDescription': None, 'descriptionUrls': None, 'verified': None, 'created': None, 'followersCount': None, 'friendsCount': None, 'statusesCount': None, 'favouritesCount': None, 'listedCount': None, 'mediaCount': None, 'location': None, 'protected': None, 'linkUrl': None, 'linkTcourl': None, 'profileImageUrl': None, 'profileBannerUrl': None, 'label': None, 'url': 'https://twitter.com/AvengerResister'}]",,,,
snscrape.modules.twitter.Tweet,https://twitter.com/GeneralPutnam2/status/1472098361117339650,2021-12-18 06:56:14+00:00,"@mmpadellan @smc429 Google: Rick Perry Putin oil Ukraine Russia.  
And, as the incandescent Eddie Izzard said, ""Et, voilà.""","@mmpadellan @smc429 Google: Rick Perry Putin oil Ukraine Russia.  
And, as the incandescent Eddie Izzard said, ""Et, voilà.""",1472098361117339650,"{'_type': 'snscrape.modules.twitter.User', 'username': 'GeneralPutnam2', 'id': 1462261669556490244, 'displayname': 'General Putnam', 'description': 'Sciences/Complexity/System Collapse. \nFighting the Bad Guys since the McCarthy era.\nWorking Morgan horses, good dogs, cat named Will Feral.', 'rawDescription': 'Sciences/Complexity/System Collapse. \nFighting the Bad Guys since the McCarthy era.\nWorking Morgan horses, good dogs, cat named Will Feral.', 'descriptionUrls': None, 'verified': False, 'created': '2021-11-21T03:30:52+00:00', 'followersCount': 3132, 'friendsCount': 3031, 'statusesCount': 17194, 'favouritesCount': 191344, 'listedCount': 2, 'mediaCount': 3143, 'location': 'Save our Public Lands', 'protected': False, 'linkUrl': None, 'linkTcourl': None, 'profileImageUrl': 'https://pbs.twimg.com/profile_images/1468855688625459203/uK13HJMJ_normal.jpg', 'profileBannerUrl': 'https://pbs.twimg.com/profile_banners/1462261669556490244/1637477586', 'label': None, 'url': 'https://twitter.com/GeneralPutnam2'}",0,1,4,0,1472029424002519046,fr,"<a href=""http://twitter.com/download/android"" rel=""nofollow"">Twitter for Android</a>",http://twitter.com/download/android,Twitter for Android,,,,,,1.472029424002519e+18,"{'_type': 'snscrape.modules.twitter.User', 'username': 'mmpadellan', 'id': 1640929196, 'displayname': 'BrooklynDad_Defiant!', 'description': None, 'rawDescription': None, 'descriptionUrls': None, 'verified': None, 'created': None, 'followersCount': None, 'friendsCount': None, 'statusesCount': None, 'favouritesCount': None, 'listedCount': None, 'mediaCount': None, 'location': None, 'protected': None, 'linkUrl': None, 'linkTcourl': None, 'profileImageUrl': None, 'profileBannerUrl': None, 'label': None, 'url': 'https://twitter.com/mmpadellan'}","[{'_type': 'snscrape.modules.twitter.User', 'username': 'mmpadellan', 'id': 1640929196, 'displayname': 'BrooklynDad_Defiant!', 'description': None, 'rawDescription': None, 'descriptionUrls': None, 'verified': None, 'created': None, 'followersCount': None, 'friendsCount': None, 'statusesCount': None, 'favouritesCount': None, 'listedCount': None, 'mediaCount': None, 'location': None, 'protected': None, 'linkUrl': None, 'linkTcourl': None, 'profileImageUrl': None, 'profileBannerUrl': None, 'label': None, 'url': 'https://twitter.com/mmpadellan'}, {'_type': 'snscrape.modules.twitter.User', 'username': 'smc429', 'id': 23554832, 'displayname': 'Brown Eyed Susan🇺🇦', 'description': None, 'rawDescription': None, 'descriptionUrls': None, 'verified': None, 'created': None, 'followersCount': None, 'friendsCount': None, 'statusesCount': None, 'favouritesCount': None, 'listedCount': None, 'mediaCount': None, 'location': None, 'protected': None, 'linkUrl': None, 'linkTcourl': None, 'profileImageUrl': None, 'profileBannerUrl': None, 'label': None, 'url': 'https://twitter.com/smc429'}]",,,,
snscrape.modules.twitter.Tweet,https://twitter.com/AISolutionMY/status/1472094936535240709,2021-12-18 06:42:37+00:00,"供应链。。葵花籽油

#供应链 #食品油 #食用油

初搾/精煉葵花籽油供應
原產地：泰國/烏克蘭/蘇聯/其他
到岸價-中國任何港口/ 馬來西亞港口

Unrefined /Refine CRUDE SUN FLOWER OIL Supply
Origin : Thailand/ Ukraine/Russia/ Others
CIF China Any port/Malaysia Port https://t.co/IC0CFY9opj","供应链。。葵花籽油

#供应链 #食品油 #食用油

初搾/精煉葵花籽油供應
原產地：泰國/烏克蘭/蘇聯/其他
到岸價-中國任何港口/ 馬來西亞港口

Unrefined /Refine CRUDE SUN FLOWER OIL Supply
Origin : Thailand/ Ukraine/Russia/ Others
CIF China Any port/Malaysia Port https://t.co/IC0CFY9opj",1472094936535240709,"{'_type': 'snscrape.modules.twitter.User', 'username': 'AISolutionMY', 'id': 1498655096, 'displayname': 'Ai Solution', 'description': '微信：M0189292686', 'rawDescription': '微信：M0189292686', 'descriptionUrls': None, 'verified': False, 'created': '2013-06-10T16:05:26+00:00', 'followersCount': 136, 'friendsCount': 506, 'statusesCount': 2749, 'favouritesCount': 65, 'listedCount': 1, 'mediaCount': 1798, 'location': '', 'protected': False, 'linkUrl': None, 'linkTcourl': None, 'profileImageUrl': 'https://pbs.twimg.com/profile_images/531470681225973761/BcuU5JGj_normal.jpeg', 'profileBannerUrl': 'https://pbs.twimg.com/profile_banners/1498655096/1632901153', 'label': None, 'url': 'https://twitter.com/AISolutionMY'}",0,0,0,0,1472094936535240709,zh,"<a href=""http://twitter.com/download/android"" rel=""nofollow"">Twitter for Android</a>",http://twitter.com/download/android,Twitter for Android,,,"[{'_type': 'snscrape.modules.twitter.Photo', 'previewUrl': 'https://pbs.twimg.com/media/FG3uixpVEAEBlJi?format=jpg&name=small', 'fullUrl': 'https://pbs.twimg.com/media/FG3uixpVEAEBlJi?format=jpg&name=large'}]",,,,,,,,"['供应链', '食品油', '食用油']",
