_type,url,date,content,renderedContent,id,user,replyCount,retweetCount,likeCount,quoteCount,conversationId,lang,source,sourceUrl,sourceLabel,outlinks,tcooutlinks,media,retweetedTweet,quotedTweet,inReplyToTweetId,inReplyToUser,mentionedUsers,coordinates,place,hashtags,cashtags
snscrape.modules.twitter.Tweet,https://twitter.com/bmeier79/status/1469282272385945604,2021-12-10 12:26:06+00:00,"Russia’s oil and gas reserves, there’s money to be made and they want in. Tucker Carlson even made a comment about it the other day when discussing Ukraine. Then there’s the Republican Congressmen who visited Russia on the 4th of July a few years ago. https://t.co/SboLa8fKZV","Russia’s oil and gas reserves, there’s money to be made and they want in. Tucker Carlson even made a comment about it the other day when discussing Ukraine. Then there’s the Republican Congressmen who visited Russia on the 4th of July a few years ago. twitter.com/Logically_JC/s…",1469282272385945604,"{'_type': 'snscrape.modules.twitter.User', 'username': 'bmeier79', 'id': 1934819292, 'displayname': 'Robert C Meier', 'description': 'Twentyseven years Mass. state police. 12 years insurance fraud investigator. #TheResistance', 'rawDescription': 'Twentyseven years Mass. state police. 12 years insurance fraud investigator. #TheResistance', 'descriptionUrls': None, 'verified': False, 'created': '2013-10-04T17:07:57+00:00', 'followersCount': 3774, 'friendsCount': 4795, 'statusesCount': 157415, 'favouritesCount': 118053, 'listedCount': 7, 'mediaCount': 2884, 'location': 'Massachusetts, USA', 'protected': False, 'linkUrl': None, 'linkTcourl': None, 'profileImageUrl': 'https://pbs.twimg.com/profile_images/825016225042399236/VgA15bOQ_normal.jpg', 'profileBannerUrl': None, 'label': None, 'url': 'https://twitter.com/bmeier79'}",0,0,0,0,1469282272385945604,en,"<a href=""http://twitter.com/download/iphone"" rel=""nofollow"">Twitter for iPhone</a>",http://twitter.com/download/iphone,Twitter for iPhone,['https://twitter.com/Logically_JC/status/1468939618880000002'],['https://t.co/SboLa8fKZV'],,,"{'_type': 'snscrape.modules.twitter.Tweet', 'url': 'https://twitter.com/Logically_JC/status/1468939618880000002', 'date': '2021-12-09T13:44:31+00:00', 'content': 'Can someone explain to me why Republicans are siding with Vladimir Putin over the President of the United States?', 'renderedContent': 'Can someone explain to me why Republicans are siding with Vladimir Putin over the President of the United States?', 'id': 1468939618880000002, 'user': {'_type': 'snscrape.modules.twitter.User', 'username': 'Logically_JC', 'id': 1271162030393896968, 'displayname': 'John Collins', 'description': 'Dad ☆ Husband ☆ Low-Key Nerd ☆ EdD / JD', 'rawDescription': 'Dad ☆ Husband ☆ Low-Key Nerd ☆ EdD / JD', 'descriptionUrls': None, 'verified': False, 'created': '2020-06-11T19:27:09+00:00', 'followersCount': 113451, 'friendsCount': 17816, 'statusesCount': 27713, 'favouritesCount': 343106, 'listedCount': 221, 'mediaCount': 725, 'location': 'Boston, MA ☆ ', 'protected': False, 'linkUrl': None, 'linkTcourl': None, 'profileImageUrl': 'https://pbs.twimg.com/profile_images/1475451886404833284/EDGpNwwU_normal.jpg', 'profileBannerUrl': 'https://pbs.twimg.com/profile_banners/1271162030393896968/1637765718', 'label': None, 'url': 'https://twitter.com/Logically_JC'}, 'replyCount': 3938, 'retweetCount': 6262, 'likeCount': 32901, 'quoteCount': 851, 'conversationId': 1468939618880000002, 'lang': 'en', 'source': '<a href=""http://twitter.com/#!/download/ipad"" rel=""nofollow"">Twitter for iPad</a>', 'sourceUrl': 'http://twitter.com/#!/download/ipad', 'sourceLabel': 'Twitter for iPad', 'outlinks': None, 'tcooutlinks': None, 'media': None, 'retweetedTweet': None, 'quotedTweet': None, 'inReplyToTweetId': None, 'inReplyToUser': None, 'mentionedUsers': None, 'coordinates': None, 'place': None, 'hashtags': None, 'cashtags': None}",,,,"{'_type': 'snscrape.modules.twitter.Coordinates', 'longitude': -71.0369469, 'latitude': 41.929851}","{'_type': 'snscrape.modules.twitter.Place', 'fullName': 'Bridgewater, MA', 'name': 'Bridgewater', 'type': 'city', 'country': 'United States', 'countryCode': 'US'}",,
snscrape.modules.twitter.Tweet,https://twitter.com/MBS4America/status/1469265732785610753,2021-12-10 11:20:22+00:00,"@Acosta and what has this administration done about the
Border Crisis?
Afghanys that killed our 13 servicemen
The out of control Inflation?
Covid exploding again?
Energy Crisis?
Gas and Oil prices soaring?
Russia/Ukraine?
China/Taiwain
They are failing at every corner
Stop the charade","@Acosta and what has this administration done about the
Border Crisis?
Afghanys that killed our 13 servicemen
The out of control Inflation?
Covid exploding again?
Energy Crisis?
Gas and Oil prices soaring?
Russia/Ukraine?
China/Taiwain
They are failing at every corner
Stop the charade",1469265732785610753,"{'_type': 'snscrape.modules.twitter.User', 'username': 'MBS4America', 'id': 1458860803235487751, 'displayname': 'Meatball 4 America', 'description': 'Enough Chicken Soup for the Soul, MEATBALLS FOR AMERICA, is what we need. Speak Freely on the ""What Say You?"" Hotline: (307)-363-2669 Listen in! Chime In!!', 'rawDescription': 'Enough Chicken Soup for the Soul, MEATBALLS FOR AMERICA, is what we need. Speak Freely on the ""What Say You?"" Hotline: (307)-363-2669 Listen in! Chime In!!', 'descriptionUrls': None, 'verified': False, 'created': '2021-11-11T18:15:28+00:00', 'followersCount': 11, 'friendsCount': 71, 'statusesCount': 3220, 'favouritesCount': 198, 'listedCount': 1, 'mediaCount': 22, 'location': 'North East US of America', 'protected': False, 'linkUrl': 'https://linktr.ee/meatballsforamerica', 'linkTcourl': 'https://t.co/4LLbhXvqOd', 'profileImageUrl': 'https://pbs.twimg.com/profile_images/1481377660458647555/M3uJgt4W_normal.jpg', 'profileBannerUrl': 'https://pbs.twimg.com/profile_banners/1458860803235487751/1642022986', 'label': None, 'url': 'https://twitter.com/MBS4America'}",0,0,0,0,1469057489689886724,en,"<a href=""https://mobile.twitter.com"" rel=""nofollow"">Twitter Web App</a>",https://mobile.twitter.com,Twitter Web App,,,,,,1.4690574896898867e+18,"{'_type': 'snscrape.modules.twitter.User', 'username': 'Acosta', 'id': 22771961, 'displayname': 'Jim Acosta', 'description': None, 'rawDescription': None, 'descriptionUrls': None, 'verified': None, 'created': None, 'followersCount': None, 'friendsCount': None, 'statusesCount': None, 'favouritesCount': None, 'listedCount': None, 'mediaCount': None, 'location': None, 'protected': None, 'linkUrl': None, 'linkTcourl': None, 'profileImageUrl': None, 'profileBannerUrl': None, 'label': None, 'url': 'https://twitter.com/Acosta'}","[{'_type': 'snscrape.modules.twitter.User', 'username': 'Acosta', 'id': 22771961, 'displayname': 'Jim Acosta', 'description': None, 'rawDescription': None, 'descriptionUrls': None, 'verified': None, 'created': None, 'followersCount': None, 'friendsCount': None, 'statusesCount': None, 'favouritesCount': None, 'listedCount': None, 'mediaCount': None, 'location': None, 'protected': None, 'linkUrl': None, 'linkTcourl': None, 'profileImageUrl': None, 'profileBannerUrl': None, 'label': None, 'url': 'https://twitter.com/Acosta'}]",,,,
snscrape.modules.twitter.Tweet,https://twitter.com/ElliotKane/status/1469237032933367811,2021-12-10 09:26:20+00:00,"@TelegraphWorld No amount of sanctions are going to act as a deterrent. I think that's pretty obvious. The EU is completely reliant on Russia for oil &amp; gas, so I doubt Putin cares what they do. He's testing America/NATO and/or trying to force something out of Ukraine.","@TelegraphWorld No amount of sanctions are going to act as a deterrent. I think that's pretty obvious. The EU is completely reliant on Russia for oil &amp; gas, so I doubt Putin cares what they do. He's testing America/NATO and/or trying to force something out of Ukraine.",1469237032933367811,"{'_type': 'snscrape.modules.twitter.User', 'username': 'ElliotKane', 'id': 77423478, 'displayname': 'Elliot Kane', 'description': 'Philosopher & student of times; ever-fascinated by the grand chaotic swirl of human interaction. Political centrist. Lover of music.', 'rawDescription': 'Philosopher & student of times; ever-fascinated by the grand chaotic swirl of human interaction. Political centrist. Lover of music.', 'descriptionUrls': None, 'verified': False, 'created': '2009-09-26T07:37:42+00:00', 'followersCount': 223, 'friendsCount': 56, 'statusesCount': 51065, 'favouritesCount': 1253, 'listedCount': 0, 'mediaCount': 2984, 'location': 'London, England', 'protected': False, 'linkUrl': None, 'linkTcourl': None, 'profileImageUrl': 'https://pbs.twimg.com/profile_images/746396051402264576/0TcaEtKK_normal.jpg', 'profileBannerUrl': None, 'label': None, 'url': 'https://twitter.com/ElliotKane'}",0,0,0,0,1469215874754269190,en,"<a href=""https://mobile.twitter.com"" rel=""nofollow"">Twitter Web App</a>",https://mobile.twitter.com,Twitter Web App,,,,,,1.4692158747542692e+18,"{'_type': 'snscrape.modules.twitter.User', 'username': 'TelegraphWorld', 'id': 19706851, 'displayname': 'Telegraph World News', 'description': None, 'rawDescription': None, 'descriptionUrls': None, 'verified': None, 'created': None, 'followersCount': None, 'friendsCount': None, 'statusesCount': None, 'favouritesCount': None, 'listedCount': None, 'mediaCount': None, 'location': None, 'protected': None, 'linkUrl': None, 'linkTcourl': None, 'profileImageUrl': None, 'profileBannerUrl': None, 'label': None, 'url': 'https://twitter.com/TelegraphWorld'}","[{'_type': 'snscrape.modules.twitter.User', 'username': 'TelegraphWorld', 'id': 19706851, 'displayname': 'Telegraph World News', 'description': None, 'rawDescription': None, 'descriptionUrls': None, 'verified': None, 'created': None, 'followersCount': None, 'friendsCount': None, 'statusesCount': None, 'favouritesCount': None, 'listedCount': None, 'mediaCount': None, 'location': None, 'protected': None, 'linkUrl': None, 'linkTcourl': None, 'profileImageUrl': None, 'profileBannerUrl': None, 'label': None, 'url': 'https://twitter.com/TelegraphWorld'}]",,,,
snscrape.modules.twitter.Tweet,https://twitter.com/FarEasterner/status/1469186365577478152,2021-12-10 06:05:00+00:00,why @EU_Commission not preparing for possible embargo of Russian oil/gas if @KremlinRussia_E invades Ukraine https://t.co/5tlgKN3s0w,why @EU_Commission not preparing for possible embargo of Russian oil/gas if @KremlinRussia_E invades Ukraine twitter.com/bneeditor/stat…,1469186365577478152,"{'_type': 'snscrape.modules.twitter.User', 'username': 'FarEasterner', 'id': 261109532, 'displayname': 'Andrey Davydov', 'description': 'my hobby history and football\nEurasian Rulers\nRussian politics and football\nt.me/eurasianrulers', 'rawDescription': 'my hobby history and football\nEurasian Rulers\nRussian politics and football\nhttps://t.co/fvfp4bIzRN', 'descriptionUrls': [{'text': 't.me/eurasianrulers', 'url': 'https://t.me/eurasianrulers', 'tcourl': 'https://t.co/fvfp4bIzRN', 'indices': [76, 99]}], 'verified': False, 'created': '2011-03-05T07:32:25+00:00', 'followersCount': 1816, 'friendsCount': 2133, 'statusesCount': 258016, 'favouritesCount': 2101, 'listedCount': 171, 'mediaCount': 15057, 'location': '', 'protected': False, 'linkUrl': None, 'linkTcourl': None, 'profileImageUrl': 'https://pbs.twimg.com/profile_images/1251404140028329985/E7A538E2_normal.jpg', 'profileBannerUrl': 'https://pbs.twimg.com/profile_banners/261109532/1646497808', 'label': None, 'url': 'https://twitter.com/FarEasterner'}",0,1,1,0,1469186365577478152,en,"<a href=""http://twitter.com/download/android"" rel=""nofollow"">Twitter for Android</a>",http://twitter.com/download/android,Twitter for Android,['https://twitter.com/bneeditor/status/1469185681490530304'],['https://t.co/5tlgKN3s0w'],,,"{'_type': 'snscrape.modules.twitter.Tweet', 'url': 'https://twitter.com/bneeditor/status/1469185681490530304', 'date': '2021-12-10T06:02:17+00:00', 'content': 'Gas storage in Europe continues to fall at alarming rates\n\nCurrently tanks are 64% full. same level as Jan 13, 2020\n\nDec 8 2020 there was 84% ie 20% more\n\nstorage in 2020 bottomed out on Mar 24 with 30% in storage\n\n=&gt; just enuf gas, but bottom out w/only 10% in storage Mar 2022 https://t.co/aeHqf6jEHt', 'renderedContent': 'Gas storage in Europe continues to fall at alarming rates\n\nCurrently tanks are 64% full. same level as Jan 13, 2020\n\nDec 8 2020 there was 84% ie 20% more\n\nstorage in 2020 bottomed out on Mar 24 with 30% in storage\n\n=&gt; just enuf gas, but bottom out w/only 10% in storage Mar 2022 https://t.co/aeHqf6jEHt', 'id': 1469185681490530304, 'user': {'_type': 'snscrape.modules.twitter.User', 'username': 'bneeditor', 'id': 2608248157, 'displayname': 'BenAris', 'description': 'long time Russia reporter. ex Daily Telegraph moscow bureau, ex Banker/Euromoney contributing editor, 15 yrs freelance. founder & editor business new europe', 'rawDescription': 'long time Russia reporter. ex Daily Telegraph moscow bureau, ex Banker/Euromoney contributing editor, 15 yrs freelance. founder & editor business new europe', 'descriptionUrls': None, 'verified': False, 'created': '2014-07-06T19:58:42+00:00', 'followersCount': 10026, 'friendsCount': 847, 'statusesCount': 58207, 'favouritesCount': 19216, 'listedCount': 388, 'mediaCount': 6748, 'location': 'Berlin, Germany', 'protected': False, 'linkUrl': 'http://www.bne.eu', 'linkTcourl': 'https://t.co/E1oktUdIV3', 'profileImageUrl': 'https://pbs.twimg.com/profile_images/815841564706635776/Rf_d3NJx_normal.jpg', 'profileBannerUrl': None, 'label': None, 'url': 'https://twitter.com/bneeditor'}, 'replyCount': 1, 'retweetCount': 5, 'likeCount': 11, 'quoteCount': 1, 'conversationId': 1469185681490530304, 'lang': 'en', 'source': '<a href=""https://about.twitter.com/products/tweetdeck"" rel=""nofollow"">TweetDeck</a>', 'sourceUrl': 'https://about.twitter.com/products/tweetdeck', 'sourceLabel': 'TweetDeck', 'outlinks': None, 'tcooutlinks': None, 'media': [{'_type': 'snscrape.modules.twitter.Photo', 'previewUrl': 'https://pbs.twimg.com/media/FGOYYwoWUAI2Bmq?format=png&name=small', 'fullUrl': 'https://pbs.twimg.com/media/FGOYYwoWUAI2Bmq?format=png&name=large'}], 'retweetedTweet': None, 'quotedTweet': None, 'inReplyToTweetId': None, 'inReplyToUser': None, 'mentionedUsers': None, 'coordinates': None, 'place': None, 'hashtags': None, 'cashtags': None}",,,"[{'_type': 'snscrape.modules.twitter.User', 'username': 'EU_Commission', 'id': 157981564, 'displayname': 'European Commission 🇪🇺', 'description': None, 'rawDescription': None, 'descriptionUrls': None, 'verified': None, 'created': None, 'followersCount': None, 'friendsCount': None, 'statusesCount': None, 'favouritesCount': None, 'listedCount': None, 'mediaCount': None, 'location': None, 'protected': None, 'linkUrl': None, 'linkTcourl': None, 'profileImageUrl': None, 'profileBannerUrl': None, 'label': None, 'url': 'https://twitter.com/EU_Commission'}, {'_type': 'snscrape.modules.twitter.User', 'username': 'KremlinRussia_E', 'id': 205622130, 'displayname': 'President of Russia', 'description': None, 'rawDescription': None, 'descriptionUrls': None, 'verified': None, 'created': None, 'followersCount': None, 'friendsCount': None, 'statusesCount': None, 'favouritesCount': None, 'listedCount': None, 'mediaCount': None, 'location': None, 'protected': None, 'linkUrl': None, 'linkTcourl': None, 'profileImageUrl': None, 'profileBannerUrl': None, 'label': None, 'url': 'https://twitter.com/KremlinRussia_E'}]",,,,
snscrape.modules.twitter.Tweet,https://twitter.com/MBS4America/status/1469167428450070534,2021-12-10 04:49:45+00:00,"@JoyAnnReid Border Crisis? Energy Crisis? Out of control gas/oil prices? China/Taiwan? Russia/Ukraine? Soaring inflation? He cant recite/read three straight coherent sentences, Afghanistan embarrassment, Our horrible world image, And 70% of us, dont believe a word he says, and Harris lol","@JoyAnnReid Border Crisis? Energy Crisis? Out of control gas/oil prices? China/Taiwan? Russia/Ukraine? Soaring inflation? He cant recite/read three straight coherent sentences, Afghanistan embarrassment, Our horrible world image, And 70% of us, dont believe a word he says, and Harris lol",1469167428450070534,"{'_type': 'snscrape.modules.twitter.User', 'username': 'MBS4America', 'id': 1458860803235487751, 'displayname': 'Meatball 4 America', 'description': 'Enough Chicken Soup for the Soul, MEATBALLS FOR AMERICA, is what we need. Speak Freely on the ""What Say You?"" Hotline: (307)-363-2669 Listen in! Chime In!!', 'rawDescription': 'Enough Chicken Soup for the Soul, MEATBALLS FOR AMERICA, is what we need. Speak Freely on the ""What Say You?"" Hotline: (307)-363-2669 Listen in! Chime In!!', 'descriptionUrls': None, 'verified': False, 'created': '2021-11-11T18:15:28+00:00', 'followersCount': 11, 'friendsCount': 71, 'statusesCount': 3220, 'favouritesCount': 198, 'listedCount': 1, 'mediaCount': 22, 'location': 'North East US of America', 'protected': False, 'linkUrl': 'https://linktr.ee/meatballsforamerica', 'linkTcourl': 'https://t.co/4LLbhXvqOd', 'profileImageUrl': 'https://pbs.twimg.com/profile_images/1481377660458647555/M3uJgt4W_normal.jpg', 'profileBannerUrl': 'https://pbs.twimg.com/profile_banners/1458860803235487751/1642022986', 'label': None, 'url': 'https://twitter.com/MBS4America'}",0,0,0,0,1469019726747680776,en,"<a href=""https://mobile.twitter.com"" rel=""nofollow"">Twitter Web App</a>",https://mobile.twitter.com,Twitter Web App,,,,,,1.4690197267476808e+18,"{'_type': 'snscrape.modules.twitter.User', 'username': 'JoyAnnReid', 'id': 49698134, 'displayname': 'Joy-Ann (Pro-Democracy) Reid 😷', 'description': None, 'rawDescription': None, 'descriptionUrls': None, 'verified': None, 'created': None, 'followersCount': None, 'friendsCount': None, 'statusesCount': None, 'favouritesCount': None, 'listedCount': None, 'mediaCount': None, 'location': None, 'protected': None, 'linkUrl': None, 'linkTcourl': None, 'profileImageUrl': None, 'profileBannerUrl': None, 'label': None, 'url': 'https://twitter.com/JoyAnnReid'}","[{'_type': 'snscrape.modules.twitter.User', 'username': 'JoyAnnReid', 'id': 49698134, 'displayname': 'Joy-Ann (Pro-Democracy) Reid 😷', 'description': None, 'rawDescription': None, 'descriptionUrls': None, 'verified': None, 'created': None, 'followersCount': None, 'friendsCount': None, 'statusesCount': None, 'favouritesCount': None, 'listedCount': None, 'mediaCount': None, 'location': None, 'protected': None, 'linkUrl': None, 'linkTcourl': None, 'profileImageUrl': None, 'profileBannerUrl': None, 'label': None, 'url': 'https://twitter.com/JoyAnnReid'}]",,,,
snscrape.modules.twitter.Tweet,https://twitter.com/itsonUlibtards/status/1469165681316794370,2021-12-10 04:42:48+00:00,"@maxmorton6GDM @APhilosophae This cuts a lot of ways. 

Russia/Ukraine is a distraction for  China to act.

China/Taiwan is a distraction for Russia to act.

China Olympics is going to be used just as Hitler did.

Russia controls oil and gas flow into NATO countries.

We have never been weaker","@maxmorton6GDM @APhilosophae This cuts a lot of ways. 

Russia/Ukraine is a distraction for  China to act.

China/Taiwan is a distraction for Russia to act.

China Olympics is going to be used just as Hitler did.

Russia controls oil and gas flow into NATO countries.

We have never been weaker",1469165681316794370,"{'_type': 'snscrape.modules.twitter.User', 'username': 'itsonUlibtards', 'id': 1375233501927075840, 'displayname': 'Fresh Air', 'description': '', 'rawDescription': '', 'descriptionUrls': None, 'verified': False, 'created': '2021-03-25T23:50:07+00:00', 'followersCount': 5, 'friendsCount': 198, 'statusesCount': 5000, 'favouritesCount': 1140, 'listedCount': 0, 'mediaCount': 650, 'location': 'Nevada, USA', 'protected': False, 'linkUrl': None, 'linkTcourl': None, 'profileImageUrl': 'https://abs.twimg.com/sticky/default_profile_images/default_profile_normal.png', 'profileBannerUrl': None, 'label': None, 'url': 'https://twitter.com/itsonUlibtards'}",0,0,2,0,1469137133680181253,en,"<a href=""http://twitter.com/download/iphone"" rel=""nofollow"">Twitter for iPhone</a>",http://twitter.com/download/iphone,Twitter for iPhone,,,,,,1.4691422180238705e+18,"{'_type': 'snscrape.modules.twitter.User', 'username': 'maxmorton6GDM', 'id': 1419718658193072129, 'displayname': 'Max Morton', 'description': None, 'rawDescription': None, 'descriptionUrls': None, 'verified': None, 'created': None, 'followersCount': None, 'friendsCount': None, 'statusesCount': None, 'favouritesCount': None, 'listedCount': None, 'mediaCount': None, 'location': None, 'protected': None, 'linkUrl': None, 'linkTcourl': None, 'profileImageUrl': None, 'profileBannerUrl': None, 'label': None, 'url': 'https://twitter.com/maxmorton6GDM'}","[{'_type': 'snscrape.modules.twitter.User', 'username': 'maxmorton6GDM', 'id': 1419718658193072129, 'displayname': 'Max Morton', 'description': None, 'rawDescription': None, 'descriptionUrls': None, 'verified': None, 'created': None, 'followersCount': None, 'friendsCount': None, 'statusesCount': None, 'favouritesCount': None, 'listedCount': None, 'mediaCount': None, 'location': None, 'protected': None, 'linkUrl': None, 'linkTcourl': None, 'profileImageUrl': None, 'profileBannerUrl': None, 'label': None, 'url': 'https://twitter.com/maxmorton6GDM'}, {'_type': 'snscrape.modules.twitter.User', 'username': 'APhilosophae', 'id': 931681289614385158, 'displayname': 'CulturalHusbandry', 'description': None, 'rawDescription': None, 'descriptionUrls': None, 'verified': None, 'created': None, 'followersCount': None, 'friendsCount': None, 'statusesCount': None, 'favouritesCount': None, 'listedCount': None, 'mediaCount': None, 'location': None, 'protected': None, 'linkUrl': None, 'linkTcourl': None, 'profileImageUrl': None, 'profileBannerUrl': None, 'label': None, 'url': 'https://twitter.com/APhilosophae'}]",,,,
snscrape.modules.twitter.Tweet,https://twitter.com/argosfan1964/status/1469156177145700355,2021-12-10 04:05:02+00:00,@GasPriceWizard @FoodProfessor The number in the report is conservative. Canadians could see much higher prices. World price of oil will jump if Russia invades Ukraine Liberal government imposes more carbon tax Hope for the best but prepare for the worst,@GasPriceWizard @FoodProfessor The number in the report is conservative. Canadians could see much higher prices. World price of oil will jump if Russia invades Ukraine Liberal government imposes more carbon tax Hope for the best but prepare for the worst,1469156177145700355,"{'_type': 'snscrape.modules.twitter.User', 'username': 'argosfan1964', 'id': 1421828786, 'displayname': 'Mark Hammond', 'description': 'University of Guelph\nFriend of Gryphon Football', 'rawDescription': 'University of Guelph\nFriend of Gryphon Football', 'descriptionUrls': None, 'verified': False, 'created': '2013-05-11T23:35:27+00:00', 'followersCount': 37, 'friendsCount': 164, 'statusesCount': 1116, 'favouritesCount': 4761, 'listedCount': 1, 'mediaCount': 41, 'location': 'Milton, Ontario Canada', 'protected': False, 'linkUrl': None, 'linkTcourl': None, 'profileImageUrl': 'https://pbs.twimg.com/profile_images/1171289461872889856/Zg3FJkz1_normal.jpg', 'profileBannerUrl': None, 'label': None, 'url': 'https://twitter.com/argosfan1964'}",0,0,0,0,1468966826486820877,en,"<a href=""http://twitter.com/download/android"" rel=""nofollow"">Twitter for Android</a>",http://twitter.com/download/android,Twitter for Android,,,,,,1.4689668264868209e+18,"{'_type': 'snscrape.modules.twitter.User', 'username': 'GasPriceWizard', 'id': 2926136996, 'displayname': 'Dan McTeague', 'description': None, 'rawDescription': None, 'descriptionUrls': None, 'verified': None, 'created': None, 'followersCount': None, 'friendsCount': None, 'statusesCount': None, 'favouritesCount': None, 'listedCount': None, 'mediaCount': None, 'location': None, 'protected': None, 'linkUrl': None, 'linkTcourl': None, 'profileImageUrl': None, 'profileBannerUrl': None, 'label': None, 'url': 'https://twitter.com/GasPriceWizard'}","[{'_type': 'snscrape.modules.twitter.User', 'username': 'GasPriceWizard', 'id': 2926136996, 'displayname': 'Dan McTeague', 'description': None, 'rawDescription': None, 'descriptionUrls': None, 'verified': None, 'created': None, 'followersCount': None, 'friendsCount': None, 'statusesCount': None, 'favouritesCount': None, 'listedCount': None, 'mediaCount': None, 'location': None, 'protected': None, 'linkUrl': None, 'linkTcourl': None, 'profileImageUrl': None, 'profileBannerUrl': None, 'label': None, 'url': 'https://twitter.com/GasPriceWizard'}, {'_type': 'snscrape.modules.twitter.User', 'username': 'FoodProfessor', 'id': 863444743, 'displayname': 'The Food Professor', 'description': None, 'rawDescription': None, 'descriptionUrls': None, 'verified': None, 'created': None, 'followersCount': None, 'friendsCount': None, 'statusesCount': None, 'favouritesCount': None, 'listedCount': None, 'mediaCount': None, 'location': None, 'protected': None, 'linkUrl': None, 'linkTcourl': None, 'profileImageUrl': None, 'profileBannerUrl': None, 'label': None, 'url': 'https://twitter.com/FoodProfessor'}]",,,,
